school_name,meal_date,score,summary,dish_count,dishes
臺北市內湖區新湖國小,2026-03-31,4,本餐主食、主菜、蔬菜、湯品與水果均有搭配，營養均衡。亮點為有機油江菜清燙保留纖維與礦物質，羅宋湯與味噌肉片提供豐富蔬菜，葡萄供應纖維與抗氧化劑。隱憂為主食選用白米飯纖維低，照燒花枝丸加工食物鈉糖偏高，建議減少加工食物與增加全穀類攝入。整體屬偏健康的一餐。,6,"[""葡萄"", ""有機白米飯"", ""味噌肉片"", ""照燒花枝丸"", ""羅宋湯"", ""有機油江菜""]"
臺北市內湖區明湖國中,2026-03-31,4,本餐主食、主菜、副菜、蔬菜、湯品多樣且豐富，搭配均衡。亮點為多種全穀類主食提供纖維與營養，豆製品搭配低汙染魚類、匈牙利燉豆、蔬菜豐富的副菜等，均富含營養。烹調方法多樣，清燙、燉、涼拌等手法保留食材營養，清淡湯品如芹香蘿蔔湯與玉米蛋花湯提供優質蛋白與蔬菜。隱憂為烤雞翅略高油，通心粉碳水化合物偏高，建議適當控制食用量。整體屬均衡且豐富的一餐。,18,"[""大麥飯"", ""玉米蛋花湯(非基改)"", ""(油麥菜)履歷"", ""紅藜飯"", ""小白菜"", ""匈牙利燉豬"", ""芝麻海帶"", ""鮮菇雞柳"", ""芹香蘿蔔湯"", ""(豆瓣鮮魚)非基改"", ""(鄉村粉絲)"", ""烤雞翅X1"", ""素)總匯通心粉(非基改)"", ""匈牙利燉豆(素)"", ""白米飯(素)"", ""芝麻海帶(素)"", ""芹香蘿蔔湯(素)"", ""蔬菜豆腐煲(素)""]"
臺北市內湖區明湖國小,2026-03-31,4,本餐主食、主菜、蔬菜、湯品與水果齊全，但主食選用白米飯纖維略低。亮點為蔬菜佃煮與白菜三絲羹湯提供多種蔬菜，茂谷柑提供原型水果的營養。隱憂為部分菜餚如梅干扣肉與砂鍋油腐使用高加工食材，肉羹湯的加工度高，油江菜的營養成分不足。整體屬於一般均衡的一餐，建議增加全穀主食與降低加工食材的使用。,11,"[""茂谷柑"", ""有機油江菜"", ""有機白米飯"", ""梅干扣肉"", ""砂鍋油腐(素)"", ""有機白米飯(素)"", ""有機油江菜(素)"", ""蔬菜佃煮"", ""蔬菜佃煮(素)"", ""肉羹湯"", ""白菜三絲羹湯(素)""]"
臺北市內湖區東湖國中,2026-03-31,4,本餐主食、主菜、蔬菜、湯品與副菜齊全，搭配均衡。亮點為匈牙利燉豆與匈牙利燉豬提供豐富營養，海帶豆干、芝麻海帶與蔬菜豆腐煲等副菜提供多樣化的營養素，芹香蘿蔔湯與小白菜清淡解膩；鮮菇雞柳則提供均衡的蛋白質與蔬菜。隱憂為主食選用白米飯，纖維可能偏低，海帶豆干的鈉含量需注意。整體屬均衡且多樣的一餐。,10,"[""小白菜"", ""白米飯"", ""匈牙利燉豬"", ""鮮菇雞柳"", ""芹香蘿蔔湯"", ""匈牙利燉豆(素)"", ""芝麻海帶(素)"", ""芹香蘿蔔湯(素)"", ""蔬菜豆腐煲(素)"", ""海帶豆干""]"
臺北市內湖區東湖國小,2026-03-31,3,本餐主食以白飯為主，缺乏全穀與纖維，熱量來源單一。亮點包含玉米雞香蛋、結菜鮮蔬、綜合滷味、肉茸蒸蛋等副菜，提供豐富的纖維、蛋白質與礦物質；十全養生湯與酸菜肉絲湯保留營養佳。然而，主菜筍燒豬肉與雞堡肉排的高油糖與加工肉品降低健康度，且鈉含量偏高。整體屬一般均衡，但可改善主食選擇與減少高加工食品的攝入。,12,"[""結菜鮮蔬"", ""雞堡肉排"", ""有機白飯"", ""酸菜肉絲湯A"", ""筍燒豬肉"", ""十全養生湯"", ""玉米雞香蛋"", ""有機油江菜"", ""白飯A"", ""綜合滷味1"", ""肉茸蒸蛋"", ""豆漿T""]"
臺北市內湖區潭美國小,2026-03-31,4,本餐主食、主菜、蔬菜、湯品與水果齊全，但主食選用白米飯，纖維低。亮點為金粒高麗菜營養豐富、有機油江菜清燙保留纖維與礦物質、味噌海芽湯富纖維與礦物、保久乳鈣質豐富。隱憂為蔥燒肉柳高油糖，肉質一般，主食纖維低，保久乳脂肪含量較高。整體屬一般均衡的一餐，建議減少油炸與高糖食物，增加全穀類與低脂奶製品。,6,"[""保久乳"", ""有機白米飯"", ""蔥燒肉柳"", ""金粒高麗菜"", ""味噌海芽湯"", ""有機油江菜""]"
臺北市內湖區碧湖國小,2026-03-31,4,本餐主食、主菜、蔬菜、湯品與水果齊全，但主食選用白米飯纖維低。亮點為蔬菜佃煮與白菜三絲羹湯提供多種蔬菜，茂谷柑原型水果營養豐富。隱憂為部分菜餚如梅干扣肉、砂鍋油腐與肉羹湯加工度較高，油江菜營養成分不足，建議增加全穀類與新鮮蔬菜的比例，減少加工食品的使用。整體屬偏健康的一餐。,11,"[""茂谷柑"", ""有機油江菜"", ""有機白米飯"", ""梅干扣肉"", ""砂鍋油腐(素)"", ""有機白米飯(素)"", ""有機油江菜(素)"", ""蔬菜佃煮"", ""蔬菜佃煮(素)"", ""肉羹湯"", ""白菜三絲羹湯(素)""]"
臺北市內湖區私立達人高中,2026-03-31,5,本餐主食、主菜、蔬菜、湯品與水果均衡搭配，咖哩雞以清淡手法煮製，保留蛋白質。亮點為紅蘿蔔炒蛋補充蛋白質與纖維，油菜與福菜筍絲湯保留原型營養，椪柑提供新鮮維生素。隱憂甚少，整體屬高度均衡且清淡的一餐，營養豐富，值得推廣。,5,"[""油菜"", ""椪柑"", ""紅蘿蔔炒蛋"", ""咖哩雞"", ""福菜筍絲湯""]"
臺北市內湖區西湖國小,2026-03-31,4,本餐主食、主菜、蔬菜、湯品與水果均有搭配，營養均衡。亮點為有機油江菜清燙保留纖維與礦物質，羅宋湯與味噌肉片提供豐富蔬菜，葡萄供應纖維與抗氧化劑。隱憂為主食選用白米飯纖維低，照燒花枝丸加工食物鈉糖偏高，建議減少加工食物與增加全穀類攝入。整體屬偏健康的一餐。,6,"[""葡萄"", ""有機白米飯"", ""味噌肉片"", ""照燒花枝丸"", ""羅宋湯"", ""有機油江菜""]"
臺北市內湖區西湖實中,2026-03-31,4,本餐主食、主蛋白、蔬菜、湯品與副菜齊全，營養均衡。亮點為五香滷肉與滑蛋豆腐提供豐富蛋白質，雙色花椰與油菜保留高纖維與維生素，玉米濃湯則提供優質的纖維與礦物質。隱憂為主食選用純粹白米，熱量來源單一，建議可替換為全穀米或其他全谷物。整體屬於均衡且營養的餐點。,6,"[""香Q白飯"", ""玉米濃湯"", ""油菜"", ""滑蛋豆腐"", ""雙色花椰"", ""五香滷肉""]"
臺北市內湖區麗山國中,2026-03-31,4,本餐主食、主蛋白、蔬菜、湯品與副菜均衡。亮點為匈牙利燉豬與蔬菜慢燉，營養保留佳；芝麻海帶與鮮菇雞柳提供豐富營養；小白菜與芹香蘿蔔湯清淡解膩，纖維與礦物質保留度佳。隱憂為主食選用白米飯，熱量來源單一，建議可替換全穀米增強纖維含量。整體屬均衡的一餐。,6,"[""小白菜"", ""白米飯"", ""匈牙利燉豬"", ""芝麻海帶"", ""鮮菇雞柳"", ""芹香蘿蔔湯""]"
臺北市內湖區麗山國小,2026-03-31,4,本餐主食、主菜、蔬菜、湯品與水果均有搭配，營養均衡。亮點為有機油江菜清燙保留纖維與礦物質，羅宋湯與味噌肉片提供豐富蔬菜，葡萄供應纖維與抗氧化劑。隱憂為主食選用白米飯纖維低，照燒花枝丸加工食物鈉糖偏高，建議減少加工食物與增加全穀類攝入。整體屬偏健康的一餐。,6,"[""葡萄"", ""有機白米飯"", ""味噌肉片"", ""照燒花枝丸"", ""羅宋湯"", ""有機油江菜""]"
臺北市內湖區麗山高中,2026-03-31,4,本餐主食、主菜、蔬菜、湯品與副菜齊全，但主食僅有白飯，缺乏纖維與蛋白質。亮點為油麥菜清燙保留纖維與礦物質，玉米蛋花湯清淡搭配優質蛋白與蔬菜，鄉村粉絲低熱量營養佳。隱憂為烤雞翅略高油，熱量偏高，通心粉碳水化合物偏高，建議增加全穀主食與控制碳水化合物攝入。整體屬偏健康的一餐。,7,"[""白飯"", ""鄉村粉絲"", ""玉米蛋花湯(非基改)"", ""油麥菜(履歷)"", ""烤雞翅X1"", ""素)總匯通心粉(非基改)"", ""(京醬肉柳)""]"
臺北市內湖區麗湖國小,2026-03-31,4,本餐主食、主蛋白、蔬菜、湯品與副菜齊全，搭配較為均衡。亮點為焗醬燉雞、豆瓣鮮魚、茶碗蒸等菜餚提供豐富蛋白質與營養，玉米蛋花湯清淡且富含纖維。然而，隱憂為紅燒肉的高脂與高糖，主食有機白飯熱量來源單一，油江菜營養較低。整體屬於營養豐富但需注意油脂與糖分攝取的一餐。,12,"[""豆瓣鮮魚(非基改)"", ""玉米蛋花湯(非基改)"", ""茶碗蒸"", ""有機白飯"", ""有機油江菜"", ""(鄉村粉絲)"", ""素)總匯通心粉(非基改)"", ""焗醬燉雞"", ""紅燒肉"", ""蒜香炒高麗菜"", ""玉米蛋花湯"", ""油江菜(有機)""]"
臺北市北投區中正高中,2026-03-31,4,本餐主食、主菜、蔬菜、副菜與水果齊全，搭配均衡。亮點為紅藜飯提供纖維與礦物質、蒜泥白肉搭配蔬菜、田園時蔬多種蔬菜組合、青江菜清燙保留纖維與礦物質、李子提供新鮮水果纖維與礦物質。隱憂為酥炸柳葉魚裹粉油炸，熱量偏高，建議減少油炸頻率或改以清蒸方式烹調。整體屬均衡偏健康的一餐。,6,"[""李子"", ""紅藜飯"", ""田園時蔬(1"", ""蒜泥白肉"", ""青江菜"", ""酥炸柳葉魚""]"
臺北市北投區北投國中,2026-03-31,4,本餐主食、主菜、副菜、蔬菜、湯品均衡搭配，主食選用胚芽飯保留糙米營養。亮點為清燙萵苣保留纖維與礦物質、和風鮮菇湯清煮保留海鮮菇營養、鮮蔬甘藍提供優質纖維。然而，瓜仔肉與海鮮排的加工程度較高，可能導致鈉與加工物質的攝入量略高。整體屬於營養均衡且清淡的一餐，建議減少加工食品的選用以提升健康度。,6,"[""胚芽飯"", ""海鮮排"", ""鮮蔬甘藍"", ""和風鮮菇湯"", ""瓜仔肉"", ""產履福山萵苣""]"
臺北市北投區大屯國小,2026-03-31,4,本餐主食、主菜、蔬菜、湯品與水果齊全，但主菜雞腿肉營養評估較低。亮點為拿坡里肉醬麵搭配蔬菜豐富，清燙有機油江菜保留纖維與礦物質，鳳梨提供新鮮水果纖維與維生素。隱憂為雞腿肉營養評估較低，玉米濃湯脂肪偏高，建議增加烹飪手法評估與控制脂肪攝入。整體屬偏健康的一餐。,5,"[""鳳梨"", ""雞腿×1"", ""拿坡里肉醬麵(特餐)"", ""玉米濃湯"", ""有機油江菜""]"
臺北市北投區文化國小,2026-03-31,3,本餐主食、主菜、蔬菜與湯品基本齊全，但營養均衡度尚可改善。亮點為有機味美菜清燙保留纖維與礦物質，滷雞腿蛋白質保留度佳。然而，夏威夷蛋炒飯中火腿與罐頭高鈉高加工，鮮肉蒸餃為加工肉類，QQ珍珠鮮奶茶高糖高熱量，缺乏營養平衡。隱憂為鈉含量偏高，建議減少高加工食品與高糖飲品的攝入，改善整體營養均衡度。,5,"[""滷雞腿"", ""夏威夷蛋炒飯"", ""鮮肉蒸餃"", ""QQ珍珠鮮奶茶"", ""有機味美菜""]"
臺北市北投區文林國小,2026-03-31,4,本餐主食、主菜、副菜、蔬菜、湯品與水果齊全，搭配均衡。亮點為日式蒸蛋提供豐富蛋白質，搭配高纖維蔬菜，仙草雞湯清淡補氣，金菇有機油江菜保留營養成分。隱憂為京醬干片與京醬肉柳使用甜麵醬，鈉與糖可能略偏高，建議減少醬汁分量。整體屬均衡偏健康的一餐。,8,"[""京醬干片(素)"", ""京醬肉柳"", ""麥片糙米飯(有機白米)"", ""日式柴魚蒸蛋"", ""日式蒸蛋(素)"", ""仙草雞湯"", ""金菇有機油江菜"", ""鮮奶""]"
臺北市北投區新民國中,2026-03-31,4,本餐主食、主菜、蔬菜、湯品與副菜搭配均衡，但主食選用白飯，缺乏纖維與蛋白質。亮點為焗醬燉雞提供豐富營養，蒜香炒高麗菜與青江菜清燙保留纖維與礦物質，玉米蛋花湯清淡富含蛋白質與纖維。隱憂為紅燒肉高脂高糖高鈉，建議減少紅燒肉的攝取量，同時考慮替換主食為全穀類以增加纖維攝取。整體屬於偏健康的一餐。,6,"[""白飯"", ""青江菜"", ""焗醬燉雞"", ""紅燒肉"", ""蒜香炒高麗菜"", ""玉米蛋花湯""]"
臺北市北投區明德國中,2026-03-31,4,本餐主食、主蛋白、蔬菜、湯品齊全，搭配均衡。亮點為紅藜飯提供纖維與礦物質，小白菜與芹香蘿蔔湯清淡保留營養，匈牙利燉豬與鮮菇雞柳均衡搭配蔬菜與蛋白質。隱憂為豬肉與雞柳可能略高脂肪，建議適量控制份量。整體屬均衡且營養豐富的一餐。,6,"[""紅藜飯"", ""小白菜"", ""匈牙利燉豬"", ""芝麻海帶"", ""鮮菇雞柳"", ""芹香蘿蔔湯""]"
臺北市北投區明德國小,2026-03-31,4,本餐主食、主蛋白、蔬菜、湯品與水果齊全，搭配較為均衡。亮點為玉米蛋花湯清淡健康，鮮奶提供天然鈣質，茄汁斜管麵保留營養。隱憂為義式燉雞腿營養素流失，肉質較硬；焗烤洋芋奶酪脂肪偏高，有機油江菜營養成分較低。整體屬偏健康的一餐，但仍需注意脂肪和營養素的平衡。,6,"[""鮮奶"", ""義式燉雞腿"", ""茄汁斜管麵"", ""焗烤洋芋"", ""玉米蛋花湯"", ""有機油江菜""]"
臺北市北投區桃源國中,2026-03-31,4,本餐主食、主菜、蔬菜、湯品與副菜齊全，搭配相當均衡。亮點為豆瓣鮮魚提供豐富營養、油麥菜清燙保留纖維與礦物質、玉米蛋花湯清淡搭配優質蛋白與蔬菜。隱憂為白飯缺乏蛋白質與纖維、烤雞翅略高油熱量偏高、通心粉碳水化合物偏高。整體屬均衡偏健康的一餐，但建議增加全穀類主食並減少高油、高熱量食物。,7,"[""白飯"", ""玉米蛋花湯(非基改)"", ""(油麥菜)履歷"", ""(豆瓣鮮魚)非基改"", ""(鄉村粉絲)"", ""烤雞翅X1"", ""素)總匯通心粉(非基改)""]"
臺北市北投區桃源國小,2026-03-31,3,本餐主食、主菜、蔬菜與湯品基本齊全，但營養均衡度尚可提升。亮點為有機味美菜清燙保留纖維與礦物質，滷雞腿蛋白質保留度佳。然而，夏威夷蛋炒飯中加入火腿與罐頭高鈉高加工，滷雞腿鈉含量偏高，鮮肉蒸餃營養較低，且QQ珍珠鮮奶茶高糖高熱量，缺乏營養平衡。整體屬一般的餐次，建議減少高鈉、高加工、高糖食物的攝入。,5,"[""滷雞腿"", ""夏威夷蛋炒飯"", ""鮮肉蒸餃"", ""QQ珍珠鮮奶茶"", ""有機味美菜""]"
臺北市北投區泉源實驗國小,2026-03-31,4,本餐主食、主菜、蔬菜、湯品與水果齊全，但主食選用白飯，缺乏蛋白質與纖維。亮點為宮保雞丁與彩椒花椰提供均衡營養，海帶芽蛋花湯搭配豬軟骨，營養豐富清淡，香蕉提供單一水果營養。隱憂為主食營養不足，油江菜營養較低，建議增加全穀或補充蛋白質食物。整體屬偏健康的一餐。,6,"[""香蕉"", ""白飯"", ""宮保雞丁"", ""彩椒花椰"", ""海帶芽蛋花湯"", ""有機油江菜""]"
臺北市北投區清江國小,2026-03-31,4,本餐主食、主菜、副菜、蔬菜、湯品與水果齊全，搭配均衡。亮點為日式蒸蛋提供豐富蛋白質，搭配高纖維蔬菜，仙草雞湯清淡補氣，金菇有機油江菜保留營養成分。隱憂為京醬干片與京醬肉柳使用甜麵醬，鈉與糖可能略偏高，建議減少醬汁分量。整體屬均衡偏健康的一餐。,8,"[""京醬干片(素)"", ""京醬肉柳"", ""麥片糙米飯(有機白米)"", ""日式柴魚蒸蛋"", ""日式蒸蛋(素)"", ""仙草雞湯"", ""金菇有機油江菜"", ""鮮奶""]"
臺北市北投區湖山國小,2026-03-31,4,本餐主食、主蛋白、蔬菜、湯品齊全，營養均衡。亮點為有機油江菜清燙保留纖維與礦物質，三鮮湯清煮保留蔬菜營養。隱憂為沙茶雞丁與蕃茄炒蛋可能添加油量，建議減少油量使用。整體屬均衡的一餐，但可再調整烹飪手法以降低油脂攝入。,5,"[""有機油江菜"", ""沙茶雞丁"", ""有機米飯"", ""蕃茄炒蛋"", ""三鮮湯""]"
臺北市北投區湖田實驗國小,2026-03-31,3,本餐主食、主菜、蔬菜與湯品基本齊全，但營養均衡度尚可改善。亮點為有機味美菜清燙保留纖維與礦物質，滷雞腿蛋白質保留度佳。然而，夏威夷蛋炒飯中火腿與罐頭高鈉高加工，鮮肉蒸餃為加工肉類，QQ珍珠鮮奶茶高糖高熱量，缺乏營養平衡。隱憂為鈉含量偏高，建議減少高加工食品與高糖飲品的攝入，改善整體營養均衡度。,5,"[""滷雞腿"", ""夏威夷蛋炒飯"", ""鮮肉蒸餃"", ""QQ珍珠鮮奶茶"", ""有機味美菜""]"
臺北市北投區石牌國中,2026-03-31,4,本餐主食、主菜、副菜、蔬菜、湯品齊全，搭配均衡。亮點為多種全穀類主食提供纖維與營養，豆瓣鮮魚與三絲湯、筍片排骨湯等菜餚保留營養豐富。烤雞翅與起司球略有熱量高與高加工之憂，但多種蔬菜清燙保留纖維與礦物質。隱憂為泡菜燒肉高鈉，建議減少泡菜分量。整體屬均衡的一餐，但仍需注意高加工與高鈉的隱憂。,12,"[""小米飯"", ""蔬炒絲瓜"", ""筍片排骨湯"", ""大麥飯"", ""(油麥菜)履歷"", ""泡菜燒肉"", ""起司球x2"", ""(豆瓣鮮魚)非基改"", ""烤雞翅X1"", ""炒高麗菜"", ""三絲湯"", ""綠蔬福山萵苣""]"
臺北市北投區石牌國小,2026-03-31,4,本餐主食、主菜、蔬菜、湯品與水果齊全，搭配較為均衡。亮點為小米飯富含纖維、茶碗蒸蛋白質與纖維豐富、玉米蛋花湯清淡搭配優質蛋白與蔬菜、水果棗子富含纖維與礦物質。隱憂為部分菜餚如泡菜燒肉高鈉、鮮菇炒蛋炒製油量略高、蜜棗李高糖熱量偏高，建議減少高鈉與高糖食材的使用，並控制油量。整體屬偏健康的一餐，但仍需注意均衡營養與控制熱量。,14,"[""蔬炒絲瓜"", ""鮮菇炒蛋"", ""筍片排骨湯"", ""玉米蛋花湯(非基改)"", ""京醬肉柳"", ""蜜棗李"", ""茶碗蒸"", ""泡菜燒肉"", ""水果棗子"", ""有機白飯"", ""(鄉村粉絲)"", ""油江菜(有機)"", ""小米飯(有機米)"", ""有機蔬菜(台北市)油江菜""]"
臺北市北投區私立幼華高中,2026-03-31,4,本餐主食、主菜、蔬菜、湯品與副菜基本齊全，但主食僅有白飯，缺乏纖維與蛋白質。亮點為油麥菜清燙保留纖維與礦物質，玉米蛋花湯清淡營養，鄉村粉絲低熱量豐富纖維。隱憂為綜合關東煮使用高加工食材，烤雞翅略高油熱量偏高，京醬肉柳缺乏完整烹飪手法資訊，建議增加全穀主食、減少加工食材與油炸食品。整體屬一般均衡的一餐。,7,"[""白飯"", ""綜合關東煮"", ""鄉村粉絲"", ""玉米蛋花湯(非基改)"", ""油麥菜(履歷)"", ""烤雞翅X1"", ""(京醬肉柳)""]"
臺北市北投區私立惇敘工商,2026-03-31,4,本餐主食、主菜、蔬菜、湯品與副菜搭配均衡，但主食選用白飯，缺乏纖維與蛋白質。亮點為焗醬燉雞提供豐富營養，蒜香炒高麗菜與青江菜清燙保留纖維與礦物質，玉米蛋花湯清淡富含蛋白質與纖維。隱憂為紅燒肉高脂高糖高鈉，建議減少紅燒肉的攝取量，同時考慮替換主食為全穀類以增加纖維攝取。整體屬於偏健康的一餐。,6,"[""白飯"", ""青江菜"", ""焗醬燉雞"", ""紅燒肉"", ""蒜香炒高麗菜"", ""玉米蛋花湯""]"
臺北市北投區私立薇閣國小(低年級),2026-03-31,4,本餐主食、主蛋白、蔬菜、湯品與水果齊全，搭配均衡。亮點為地瓜飯提供纖維，日式蒸蛋與白菜肉片湯保留營養，香菇肉丁與大西瓜補充蛋白質與水分。隱憂為炒福山萵苣缺乏蛋白質，建議增加蛋白質來源。整體屬均衡偏健康的一餐。,6,"[""地瓜飯"", ""香菇肉丁"", ""日式蒸蛋"", ""白菜肉片湯"", ""炒福山萵苣"", ""大西瓜""]"
臺北市北投區私立薇閣國小(高年級),2026-03-31,4,本餐主食、主菜、蔬菜、湯品與水果齊全，搭配較為均衡。亮點為地瓜飯提供纖維，白菜肉片湯與大西瓜清淡解膩，吻仔魚炒蛋補充蛋白質。隱憂為糖醋排骨使用高加工鳳梨罐頭，營養平衡度較差，且炒青江菜與吻仔魚炒蛋略有油量，建議減少油量與選用新鮮食材。整體屬偏健康的一餐。,6,"[""地瓜飯"", ""白菜肉片湯"", ""大西瓜"", ""糖醋排骨"", ""吻仔魚炒蛋"", ""炒青江菜""]"
臺北市北投區私立薇閣高中,2026-03-31,3,本餐主食選用高加工義大利麵，搭配高加工培根，營養不均衡；主菜雖有優質雞肉，但烤製可能增加致癌物。亮點為炒青花菜保留營養，西瓜提供清爽維生素。隱憂為炸薯瓣高熱量、高油，玉米濃湯加工成分不均衡，整體屬高熱量、高加工的偏不健康餐次，建議增加清燙蔬菜並減少油炸與高加工食品。,6,"[""西瓜"", ""烤雞腿"", ""奶油培根義大利麵"", ""炸薯瓣"", ""玉米濃湯"", ""炒青花菜""]"
臺北市北投區立農國小,2026-03-31,4,本餐主食、主菜、副菜、蔬菜、湯品與水果齊全，搭配均衡。亮點為日式蒸蛋提供豐富蛋白質，搭配高纖維蔬菜，仙草雞湯清淡補氣，金菇有機油江菜保留營養成分。隱憂為京醬干片與京醬肉柳使用甜麵醬，鈉與糖可能略偏高，建議減少醬汁分量。整體屬均衡偏健康的一餐。,8,"[""京醬干片(素)"", ""京醬肉柳"", ""麥片糙米飯(有機白米)"", ""日式柴魚蒸蛋"", ""日式蒸蛋(素)"", ""仙草雞湯"", ""金菇有機油江菜"", ""鮮奶""]"
臺北市北投區義方國小,2026-03-31,4,本餐主食、主菜、副菜、蔬菜、湯品與水果齊全，搭配均衡。亮點為日式蒸蛋提供豐富蛋白質，搭配高纖維蔬菜，仙草雞湯清淡補氣，金菇有機油江菜保留營養成分。隱憂為京醬干片與京醬肉柳使用甜麵醬，鈉與糖可能略偏高，建議減少醬汁分量。整體屬均衡偏健康的一餐。,8,"[""京醬干片(素)"", ""京醬肉柳"", ""麥片糙米飯(有機白米)"", ""日式柴魚蒸蛋"", ""日式蒸蛋(素)"", ""仙草雞湯"", ""金菇有機油江菜"", ""鮮奶""]"
臺北市北投區逸仙國小,2026-03-31,3,本餐主食、主菜、蔬菜與湯品基本齊全，但營養均衡度尚可提升。亮點為有機味美菜清燙保留纖維與礦物質，滷雞腿蛋白質保留度佳。然而，夏威夷蛋炒飯中加入火腿與罐頭高鈉高加工，滷雞腿鈉含量偏高，鮮肉蒸餃營養較低，且QQ珍珠鮮奶茶高糖高熱量，缺乏營養平衡。整體屬一般的餐次，建議減少高鈉、高加工、高糖食物的攝入。,5,"[""滷雞腿"", ""夏威夷蛋炒飯"", ""鮮肉蒸餃"", ""QQ珍珠鮮奶茶"", ""有機味美菜""]"
臺北市北投區關渡國中,2026-03-31,4,本餐主食、主菜、蔬菜、湯品與副菜齊全，搭配相當均衡。亮點為豆瓣鮮魚提供豐富營養、油麥菜清燙保留纖維與礦物質、玉米蛋花湯清淡搭配優質蛋白與蔬菜。隱憂為白飯缺乏蛋白質與纖維、烤雞翅略高油熱量偏高、通心粉碳水化合物偏高。整體屬均衡偏健康的一餐，但建議增加全穀類主食並減少高油、高熱量食物。,7,"[""白飯"", ""玉米蛋花湯(非基改)"", ""(油麥菜)履歷"", ""(豆瓣鮮魚)非基改"", ""(鄉村粉絲)"", ""烤雞翅X1"", ""素)總匯通心粉(非基改)""]"
臺北市北投區關渡國小,2026-03-31,3,本餐主食、主菜、蔬菜與湯品基本齊全，但營養均衡度尚可提升。亮點為有機味美菜清燙保留纖維與礦物質，滷雞腿蛋白質保留度佳。然而，夏威夷蛋炒飯中加入火腿與罐頭高鈉高加工，滷雞腿鈉含量偏高，鮮肉蒸餃營養較低，且QQ珍珠鮮奶茶高糖高熱量，缺乏營養平衡。整體屬一般的餐次，建議減少高鈉、高加工、高糖食物的攝入。,5,"[""滷雞腿"", ""夏威夷蛋炒飯"", ""鮮肉蒸餃"", ""QQ珍珠鮮奶茶"", ""有機味美菜""]"
臺北市南港區修德國小,2026-03-31,4,本餐主食、主菜、蔬菜、湯品與水果齊全，搭配相當均衡。亮點為塔香雞丁與什錦洋芋營養豐富，清燙有機油江菜保留纖維與礦物質，李子提供新鮮水果纖維與礦物質。隱憂為三杯鮑菇與魚香炒蛋略高油，烤麩加工度高，白米飯熱量來源單一，建議增加全穀類主食。整體屬偏健康的一餐，若能調整油鹽糖的使用，將更為均衡。,9,"[""李子"", ""白米飯"", ""有機油江菜"", ""三杯鮑菇(素)"", ""塔香雞丁"", ""什錦洋芋(素)"", ""什錦烤麩(素)"", ""魚香炒蛋"", ""大滷湯""]"
臺北市南港區南港國小,2026-03-31,4,本餐主食、主菜、蔬菜、湯品與水果齊全，搭配較為均衡。亮點為塔香雞丁與什錦洋芋提供豐富營養，油江菜清燙保留纖維與礦物質，大滷湯與李子提供多種營養素。隱憂為主食選用白米飯，熱量來源單一；三杯鮑菇與魚香炒蛋略高油，什錦烤麩加工度高，建議減少高油與高加工食品的攝取。整體屬偏健康的一餐。,9,"[""李子"", ""白米飯"", ""有機油江菜"", ""三杯鮑菇(素)"", ""塔香雞丁"", ""什錦洋芋(素)"", ""什錦烤麩(素)"", ""魚香炒蛋"", ""大滷湯""]"
