school_name,meal_date,score,summary,dish_count,dishes
新北市烏來區烏來國中(小),2026-03-31,4,本餐主食、小米飯搭配白米，提供全谷物的纖維與礦物質。亮點包含清淡燙菜保留蔬菜營養、金菇蛋花湯營養豐富，以及蘋果提供纖維與抗氧化劑。隱憂為豆干炒肉絲與鐵板豆腐加工度較高，油量適中，建議減少加工食品的攝入。整體屬於均衡的一餐，但仍需注意加工食品的選擇與控制。,6,"[""蘋果"", ""豆干炒肉絲"", ""小米飯1)"", ""鐵板豆腐"", ""金菇蛋花湯"", ""產履青江白菜""]"
新北市瑞芳區九份國小,2026-03-31,4,本餐主食、主蛋白、蔬菜、湯品與水果齊全，搭配較為均衡。亮點為清燙青油菜提供纖維與礦物質，酸辣湯清淡煮法保留營養，香蕉提供豐富水果纖維。隱憂為主食僅白米飯，熱量來源單一，缺乏全穀的B群與纖維；麻婆豆腐雖蛋白足，但缺乏蔬菜纖維。整體屬偏健康的一餐，建議增加全穀類主食並多搭配各類蔬菜。,6,"[""香蕉"", ""白米飯"", ""馬鈴薯雞丁"", ""麻婆豆腐"", ""酸辣湯"", ""青油菜""]"
新北市瑞芳區吉慶國小,2026-03-31,4,本餐主食、主菜、副菜、蔬菜、湯品均衡搭配，十穀飯提供全穀的纖維與礦物質，青油菜保留完整營養。亮點為蒸蛋保留蛋白質，肉骨茶湯煮高纖維蔬菜。隱憂為滷雞腿與肉骨茶湯的鈉含量稍高，建議適量控制攝取。整體屬於均衡且營養豐富的一餐。,5,"[""青油菜"", ""滷雞腿"", ""十穀飯"", ""蒸蛋"", ""肉骨茶湯""]"
新北市瑞芳區欽賢國中,2026-03-31,4,本餐主食、主菜、副菜、蔬菜、湯品與水果齊全，搭配均衡。亮點為十穀飯提供全穀纖維、菇菇炒肉與玉米炒蛋兼顧蛋白質與纖維、有機山菠菜清燙保留營養、酸辣湯清淡煮法豐富蛋白質與蔬菜、香蕉提供單一水果營養。隱憂為菇菇炒肉與玉米炒蛋炒製略高油量，建議減少油量。整體屬均衡偏健康的一餐。,6,"[""香蕉"", ""玉米炒蛋"", ""菇菇炒肉"", ""十穀飯"", ""酸辣湯"", ""有機山菠菜""]"
新北市瑞芳區濂洞國小,2026-03-31,4,本餐主食、主蛋白、蔬菜、湯品與水果齊全，搭配均衡。亮點為小芥菜清燙保留纖維與礦物質、香菇雞湯清淡營養豐富、水果提供新鮮營養。隱憂為蘋果蜜汁豬柳的糖分略高，蒜味黃瓜搭配高加工魚卵捲營養平衡度一般。整體屬均衡偏健康的一餐，建議注意控制糖分攝取。,6,"[""紅藜小米飯"", ""蘋果蜜汁豬柳"", ""蒜味黃瓜"", ""香菇雞湯"", ""小芥菜段(有機)"", ""水果""]"
新北市瑞芳區猴硐-蒙特梭利實驗國小,2026-03-31,4,本餐主食、主蛋白、蔬菜、湯品與水果齊全，搭配均衡。亮點為清燙小芥菜保留纖維與礦物質、香菇雞湯營養豐富、水果提供新鮮營養。隱憂為蘋果蜜汁豬柳的蜜汁糖分偏多，蒜味黃瓜搭配高加工魚卵捲，營養平衡度一般。整體屬均衡偏健康的一餐，建議減少加工食品和添加糖分。,6,"[""紅藜小米飯"", ""蘋果蜜汁豬柳"", ""蒜味黃瓜"", ""香菇雞湯"", ""小芥菜段(有機)"", ""水果""]"
新北市瑞芳區瑞亭國小,2026-03-31,4,本餐主食、主菜、副菜、蔬菜、湯品與水果齊全，營養均衡。亮點為五穀飯提供全穀纖維、有機青油菜清燙保留礦物質、酸辣湯清淡煮法保留營養、茂谷柑原型水果營養豐富。隱憂為菇菇炒肉與玉米炒蛋略有油量，建議減少炒製油量。整體屬均衡且營養豐富的一餐。,6,"[""茂谷柑"", ""有機青油菜"", ""菇菇炒肉"", ""五穀飯"", ""玉米炒蛋"", ""酸辣湯""]"
新北市瑞芳區瑞柑國小,2026-03-31,4,本餐主食、主蛋白、蔬菜、湯品與水果齊全，搭配均衡。亮點為小芥菜清燙保留纖維與礦物質、香菇雞湯清淡營養豐富、水果提供新鮮營養。隱憂為蘋果蜜汁豬柳的糖分略高，蒜味黃瓜搭配高加工魚卵捲營養平衡度一般。整體屬均衡偏健康的一餐，建議注意控制糖分攝取。,6,"[""紅藜小米飯"", ""蘋果蜜汁豬柳"", ""蒜味黃瓜"", ""香菇雞湯"", ""小芥菜段(有機)"", ""水果""]"
新北市瑞芳區瑞濱國小,2026-03-31,4,本餐主食、主菜、副菜、蔬菜、湯品與附餐齊全，營養均衡。亮點為全穀雜糧飯提供豐富纖維、有機高麗菜清燙保留礦物質、豆奶補充植物蛋白與纖維。隱憂為菇菇炒肉與玉米炒蛋略高油，酸辣湯使用加工肉羹影響健康度。整體屬均衡的一餐，但建議減少油脂攝入與選用較健康的湯品。,6,"[""豆奶"", ""菇菇炒肉"", ""全穀雜糧飯"", ""玉米炒蛋"", ""酸辣湯"", ""有機高麗菜""]"
新北市瑞芳區瑞芳國中,2026-03-31,4,本餐主食、主蛋白、蔬菜、湯品與水果齊全，搭配均衡。亮點為小芥菜清燙保留纖維與礦物質、香菇雞湯清淡營養豐富、水果提供新鮮營養。隱憂為蘋果蜜汁豬柳的糖分略高，蒜味黃瓜搭配高加工魚卵捲營養平衡度一般。整體屬均衡偏健康的一餐，建議注意控制糖分攝取。,6,"[""紅藜小米飯"", ""蘋果蜜汁豬柳"", ""蒜味黃瓜"", ""香菇雞湯"", ""小芥菜段(有機)"", ""水果""]"
新北市瑞芳區瑞芳國小,2026-03-31,4,本餐主食、主蛋白、蔬菜、湯品與水果齊全，搭配均衡。亮點為小芥菜清燙保留纖維與礦物質、香菇雞湯清淡營養豐富、水果提供新鮮營養。隱憂為蘋果蜜汁豬柳的糖分略高，蒜味黃瓜搭配高加工魚卵捲營養平衡度一般。整體屬均衡偏健康的一餐，建議注意控制糖分攝取。,6,"[""紅藜小米飯"", ""蘋果蜜汁豬柳"", ""蒜味黃瓜"", ""香菇雞湯"", ""小芥菜段(有機)"", ""水果""]"
新北市瑞芳區瑞芳高工,2026-03-31,4,本餐主食、主菜、蔬菜、湯品與副菜搭配均衡。亮點為全穀紅藜小米飯提供纖維、清燙小芥菜保留礦物質、香菇雞湯營養豐富。隱憂為蘋果蜜汁豬柳的糖分略高、蒜味黃瓜搭配高加工魚卵捲，營養平衡度一般。整體屬偏健康的一餐，建議減少蜜汁糖分並選擇低加工副菜。,5,"[""紅藜小米飯"", ""蘋果蜜汁豬柳"", ""蒜味黃瓜"", ""香菇雞湯"", ""小芥菜段(有機)""]"
新北市瑞芳區瓜山國小,2026-03-31,5,本餐六大類別均衡齊全，主食十穀飯提供全穀的纖維與營養，主菜菇菇炒肉與副菜玉米炒蛋雖略增油脂，但蛋白質與纖維豐富。亮點包含有機青油菜清燙保留纖維與礦物質、酸辣湯多樣食材清煮且營養豐富、鳳梨新鮮水果提供纖維與維生素。隱憂為兩道菜肴使用炒製手法略增油脂，但整體仍屬清淡且均衡的一餐。,6,"[""菇菇炒肉"", ""十穀飯"", ""玉米炒蛋"", ""酸辣湯"", ""有機青油菜"", ""鳳梨""]"
新北市瑞芳區私立時雨高中,2026-03-31,3,本餐主食選用白飯，缺乏蛋白質與纖維，主菜豬肉滷麵輪鈉偏高且缺優質蛋白。亮點為滷白菜與清炒青江菜提供蔬菜纖維，紫菜蛋花湯低熱量且富含蛋白質與礦物質。隱憂為麥克雞塊加工度高，熱量高且營養成分不足，建議減少加工食品的攝入，並增加全穀與優質蛋白的選擇。整體屬一般的餐次，需改善主食與部分菜餚的營養均衡度。,6,"[""白飯"", ""豬肉滷麵輪"", ""滷白菜"", ""麥克雞塊"", ""紫菜蛋花湯"", ""清炒青江菜""]"
新北市瑞芳區義方國小,2026-03-31,4,本餐主食、主菜、副菜、蔬菜、湯品均衡，但主食選用白米飯，缺乏纖維與蛋白質。亮點為菇菇炒肉搭配多種菇類，玉米炒蛋補充蛋白質與纖維，小芥菜清燙保留營養，酸辣湯營養豐富。隱憂為主菜與副菜均採炒製，油量略高，建議減少油量。整體屬均衡偏健康的一餐。,5,"[""有機蔬菜小芥菜"", ""玉米炒蛋"", ""菇菇炒肉"", ""白米飯"", ""酸辣湯""]"
新北市瑞芳區鼻頭國小,2026-03-31,4,本餐主食、主蛋白、蔬菜、湯品與水果齊全，搭配較為均衡。亮點為全穀糙米白飯提供纖維，清燙有機蔬菜保留礦物質，酸菜豬血湯富含鐵，水果補充天然纖維與維生素。隱憂為滷雞翅高鈉且含加工料，寧波年糕高碳水，建議減少滷製與高碳水食物的攝取，增加清淡烹調的比例。整體屬偏健康的一餐。,6,"[""滷雞翅"", ""糙米白飯"", ""寧波年糕"", ""酸菜豬血湯"", ""有機蔬菜"", ""水果""]"
新北市石碇區和平國小,2026-03-31,4,本餐主食、主蛋白、蔬菜、湯品與水果齊全，搭配均衡。亮點為地瓜飯提供纖維，清燙有機青油菜保留礦物質，麻油鮮菇湯營養豐富，保久乳補充鈣質。隱憂為椒鹽魚丁使用高鹽調味料，保久乳脂肪含量較高，建議注意鹽與脂肪的攝取量。整體屬均衡偏健康的一餐。,6,"[""椒鹽魚丁"", ""地瓜飯"", ""玉米肉末干丁"", ""麻油鮮菇湯"", ""有機青油菜"", ""保久乳""]"
新北市石碇區永定國小,2026-03-31,3,本餐主食、主菜、蔬菜、湯品與水果齊全，但營養均衡度略有不足。亮點為糙米飯提供纖維與礦物質，有機青菜清燙保留營養，排骨湯與時令水果提供豐富營養。隱憂為主菜選用高加工肉類，營養價值低；蔥燒豆腐雖有蛋白質，但油鹽偏高。整體屬一般的餐次，建議替換高加工肉類為新鮮蛋白質來源，並調整烹調手法以減少油鹽攝入。,6,"[""糙米飯"", ""棒棒腿"", ""蔥燒豆腐"", ""排骨湯"", ""有機青菜"", ""時令水果""]"
新北市石碇區石碇國小,2026-03-31,4,本餐主食、主蛋白、蔬菜、湯品與水果齊全，搭配均衡。亮點為地瓜飯提供纖維，清燙有機青油菜保留礦物質，麻油鮮菇湯營養豐富，保久乳補充鈣質。隱憂為椒鹽魚丁使用高鹽調味料，保久乳脂肪含量較高，建議注意鹽與脂肪的攝取量。整體屬均衡偏健康的一餐。,6,"[""椒鹽魚丁"", ""地瓜飯"", ""玉米肉末干丁"", ""麻油鮮菇湯"", ""有機青油菜"", ""保久乳""]"
新北市石碇區石碇高中,2026-03-31,4,本餐主食、主蛋白、蔬菜、湯品與水果齊全，搭配均衡。亮點為地瓜飯提供纖維，清燙有機青油菜保留礦物質，麻油鮮菇湯營養豐富，保久乳補充鈣質。隱憂為椒鹽魚丁使用高鹽調味料，保久乳脂肪含量較高，建議注意鹽與脂肪的攝取量。整體屬均衡偏健康的一餐。,6,"[""椒鹽魚丁"", ""地瓜飯"", ""玉米肉末干丁"", ""麻油鮮菇湯"", ""有機青油菜"", ""保久乳""]"
新北市石碇區雲海國小,2026-03-31,4,本餐主食、主菜、蔬菜、湯品與水果齊全，搭配均衡。亮點為五穀飯提供全穀纖維、有機山菠菜清燙保留礦物質、豆芽排骨湯清煮保留蛋白質與礦物質、西瓜提供清爽維生素。隱憂為兩道主菜以炒與燒製烹調，略有油耗，建議減少油量；整體屬均衡偏健康的一餐。,6,"[""五穀飯"", ""有機山菠菜"", ""番茄花椰菜炒蛋"", ""芋頭燒雞"", ""豆芽排骨湯"", ""西瓜""]"
新北市石門區乾華國小,2026-03-31,4,本餐主食、主菜、蔬菜、湯品與水果齊全，搭配較為均衡。亮點為五色米提供全穀纖維，產履青江菜清燙保留營養，日式蒸蛋清蒸蛋白質豐富，山藥紅棗雞湯清燉營養豐富，時令水果提供新鮮纖維與礦物質。隱憂為瓜仔肉加工度高，搭配高鈉醃漬蔬菜，營養平衡度較差，建議減少加工肉類的攝入。整體屬偏健康的一餐。,6,"[""瓜仔肉"", ""五色米"", ""日式蒸蛋"", ""山藥紅棗雞湯"", ""產履青江菜"", ""時令水果""]"
新北市石門區石門實驗國中,2026-03-31,4,本餐主食、主菜、蔬菜、湯品與水果齊全，搭配較為均衡。亮點為主食麥片飯提供全穀纖維、有機青松菜清燙保留營養、山藥紅棗雞湯營養豐富、椪柑富含維生素。隱憂為瓜仔肉加工肉類搭配高鈉醃漬蔬菜，營養平衡度較差，日式蒸蛋雖蛋白質豐富但鰹魚醬油鈉偏高，建議減少高加工肉類與高鈉醬料使用。整體屬偏健康的一餐。,6,"[""瓜仔肉"", ""麥片飯"", ""日式蒸蛋"", ""山藥紅棗雞湯"", ""有機青松菜"", ""椪柑""]"
新北市石門區老梅實驗國小,2026-03-31,4,本餐主食、主菜、蔬菜、湯品與水果齊全，但營養均衡度有待改善。亮點為日式蒸蛋提供高蛋白低熱量，山藥紅棗雞湯與燙高麗菜保留營養豐富，麥片飯提供全穀纖維。隱憂為瓜仔肉加工肉類高鈉，綜合果汁添加糖分高，營養不均衡。整體屬一般均衡的一餐，建議減少加工肉類與添加糖分的食物。,6,"[""瓜仔肉"", ""麥片飯"", ""山藥紅棗雞湯"", ""日式蒸蛋"", ""有機高麗菜"", ""綜合果汁""]"
新北市萬里區大坪國小,2026-03-31,4,本餐主食、主菜、蔬菜、湯品與水果齊全，搭配均衡。亮點為糙米飯提供纖維與礦物質，清燙荷葉白菜保留營養，香蕉提供豐富水果營養。烤雞腿控油但醬料略甜，金菇泡菜豆腐清淡營養豐富，紫菜魚丸湯加入紫菜老薑平衡營養。隱憂為魚丸加工度高，建議減少加工食品的攝入。整體屬均衡偏健康的一餐。,6,"[""香蕉"", ""糙米飯"", ""烤雞腿"", ""金菇泡菜豆腐"", ""紫菜魚丸湯"", ""有機荷葉白菜""]"
新北市萬里區大鵬國小,2026-03-31,4,本餐主食、主蛋白、蔬菜、湯品與水果齊全，搭配較為均衡。亮點為糙米飯提供纖維與礦物質，有機青松菜清燙保留營養，百香果富含天然維生素礦物質。隱憂為蜜汁照燒雞丁與醬燒豆腐的糖分和油脂偏高，肉羹湯為高加工食品，營養成分不均衡。整體屬一般均衡的一餐，建議減少高糖高油食材和加工食品的使用。,6,"[""糙米飯"", ""百香果"", ""蜜汁照燒雞丁"", ""醬燒豆腐"", ""肉羹湯"", ""有機青松菜""]"
新北市萬里區崁腳國小,2026-03-31,4,本餐主食、主菜、蔬菜、湯品與水果齊全，搭配均衡。亮點為糙米飯提供纖維與礦物質，金菇泡菜豆腐清淡營養豐富，有機荷葉白菜保留纖維與礦物質，香蕉單一水果營養豐富。隱憂為烤雞腿醬料高糖，魚丸加工度高，建議減少醬料使用量並選擇低加工食品。整體屬均衡偏健康的一餐。,6,"[""香蕉"", ""糙米飯"", ""烤雞腿"", ""金菇泡菜豆腐"", ""紫菜魚丸湯"", ""有機荷葉白菜""]"
新北市萬里區萬里國中,2026-03-31,4,本餐主食、小米飯提供全穀類纖維與礦物質，主菜雖有滷雞腿鈉偏高，但副菜金菇泡菜豆腐清淡營養豐富。亮點為有機青松菜清燙保留纖維與礦物質，香蕉提供單一水果營養。隱憂為滷雞腿加工醬料不佳，紫菜魚丸湯營養不均衡，魚丸品質不佳。整體屬一般均衡的一餐，建議減少滷製與加工食品的使用。,6,"[""香蕉"", ""小米飯"", ""金菇泡菜豆腐"", ""滷雞腿"", ""紫菜魚丸湯"", ""有機青松菜""]"
新北市萬里區萬里國小,2026-03-31,4,本餐主食、主菜、蔬菜、湯品與水果齊全，搭配均衡。亮點為糙米飯提供纖維與礦物質，清燙荷葉白菜保留營養，香蕉提供豐富水果營養。烤雞腿控油但醬料略甜，金菇泡菜豆腐清淡營養豐富，紫菜魚丸湯加入紫菜老薑平衡營養。隱憂為魚丸加工度高，建議減少加工食品的攝入。整體屬均衡偏健康的一餐。,6,"[""香蕉"", ""糙米飯"", ""烤雞腿"", ""金菇泡菜豆腐"", ""紫菜魚丸湯"", ""有機荷葉白菜""]"
新北市萬里區野柳國小,2026-03-31,3,本餐主食選用白飯，缺乏蛋白質與纖維，主菜與副菜皆為高油炸食，熱量與油脂明顯偏高；但有機青松菜提供優質纖維與礦物質，蘋果則補充水果纖維與抗氧化劑。隱憂為炸雞排與炸薯條高熱量高油，玉米濃湯雖有蔬菜成分但奶油使熱量偏高。整體屬高熱量、高油的偏不健康餐次，建議減少油炸食物並增加全穀與清淡烹調的比例。,6,"[""白飯"", ""蘋果"", ""炸雞排"", ""炸薯條"", ""玉米濃湯"", ""有機青松菜""]"
新北市蘆洲區三民高中,2026-03-31,4,本餐主食、主菜、副菜、蔬菜、湯品多樣，營養均衡。亮點為多種全谷物主食、清淡滷味滷香百頁、蒜泥白肉、多種蔬菜搭配豐富纖維與礦物質。隱憂為可樂餅高加工冷凍食品、結菜黑輪高加工高鈉、酸菜肉絲湯酸菜高鈉，建議減少加工食品與高鈉食材。整體屬均衡且豐富的一餐。,18,"[""白飯"", ""結菜黑輪"", ""酸菜肉絲湯"", ""滷香百頁(素)"", ""小米飯(素)"", ""哨子豆腐(素)"", ""履歷油麥菜(素)"", ""扁豆蔬菜湯(素)"", ""腐皮白菜(素)"", ""履歷油麥菜"", ""海鮮排"", ""泰式打拋鴿蛋"", ""紅藜飯"", ""田園時蔬(1"", ""蒜泥白肉"", ""薑絲鮮瓜湯"", ""福山萵苣"", ""可樂餅(1""]"
新北市蘆洲區仁愛國小,2026-03-31,4,本餐主食、主菜、副菜、蔬菜、湯品多樣，營養均衡度佳。亮點包含糯小米飯富含纖維、滷香黑干蛋白質豐富、麻油鮮魚營養豐富、多道蔬菜清燙或炒製保留纖維與礦物質、海帶鮮菇湯富含纖維與礦物質。隱憂為部分菜餚如泡菜燒肉、瓜仔肉、酸菜肉絲湯等鈉含量較高，少數菜餚如小籠包加工度高、炒高麗菜與鮞菇炒蛋油量略高。整體屬均衡且多樣的一餐，建議減少高鈉食材與油炸加工食品。,23,"[""胚芽飯"", ""白飯"", ""酸菜肉絲湯"", ""有機小芥菜"", ""小米飯(素)"", ""哨子豆腐(素)"", ""扁豆蔬菜湯(素)"", ""腐皮白菜(素)"", ""小米飯"", ""蔬炒絲瓜"", ""鮮菇炒蛋"", ""筍片排骨湯"", ""麻油鮮魚"", ""有機小芥菜(素)"", ""滷香黑干(素)"", ""結頭菜鮮蔬"", ""瓜仔肉"", ""泡菜燒肉"", ""有機蔬菜小芥菜"", ""小籠包"", ""打拋醬鴿蛋"", ""炒高麗菜"", ""海帶鮮菇湯""]"
新北市蘆洲區忠義國小,2026-03-31,4,本餐主食、主菜、副菜、蔬菜、湯品多樣，營養均衡度佳。亮點包含糯小米飯、胚芽飯提供纖維，麻油雞、泰式打拋鴿蛋、蔬炒絲瓜、鮮菇炒蛋、鮮蔬甘藍等菜餚均搭配蔬菜與蛋白質，保留纖維與礦物質；有機小芥菜清燙，和風鮮菇湯、筍片排骨湯清淡保留營養。隱憂為部分菜餚如泡菜燒肉、瓜仔肉、結菜黑輪高鈉，海鮮排加工度高，炒製手法可能略高油量。整體屬均衡且多樣的一餐，但仍需注意控制高鈉食材與油量。,17,"[""胚芽飯"", ""麻油雞"", ""白飯"", ""結菜黑輪"", ""酸菜肉絲湯"", ""有機小芥菜"", ""海鮮排"", ""泰式打拋鴿蛋"", ""小米飯"", ""蔬炒絲瓜"", ""鮮菇炒蛋"", ""筍片排骨湯"", ""鮮蔬甘藍"", ""和風鮮菇湯"", ""瓜仔肉"", ""泡菜燒肉"", ""有機蔬菜小芥菜""]"
新北市蘆洲區成功國小,2026-03-31,3,本餐主食、主菜、蔬菜、湯品與水果齊全，搭配相當均衡。亮點為主食選用胚芽飯提供全穀營養，冬瓜大麥湯與燙小芥菜清淡保留纖維與礦物質，桶柑提供新鮮水果纖維與維生素。然而，主菜瓜仔燒肉與素肉選擇存在醃漬與高加工問題，副菜香酥芝麻球為高熱量油炸食品，營養價值低。整體屬一般均衡，但可改善的部分在於減少高加工與油炸食品的出現，增加清淡烹調手法的比例。,12,"[""胚芽飯"", ""有機小芥菜"", ""胚芽飯(素)"", ""桶柑"", ""瓜仔燒肉"", ""瓜仔素肉(素)"", ""冬瓜大麥湯(素)"", ""海根腐皮"", ""海根腐皮(素)"", ""香酥芝麻球"", ""香酥芝麻球(素)"", ""冬瓜大麥湯""]"
新北市蘆洲區私立徐匯高中,2026-03-31,4,本餐主食、主蛋白、蔬菜、湯品與副菜齊全，但主食選用白飯，缺乏蛋白質與纖維。亮點為清燙小芥菜保留纖維與礦物質，酸辣湯清淡且營養豐富。隱憂為主菜雞腿排缺乏蔬菜搭配，副菜雖有豆製品補充蛋白，但缺乏明確烹飪手法評估，建議增加蔬菜搭配與選用清淡烹飪手法。整體屬偏健康的一餐。,6,"[""白飯"", ""有機小芥菜"", ""紐澳良腿排"", ""朴菜筍干"", ""麻婆豆腐"", ""酸辣湯""]"
新北市蘆洲區蘆洲國中,2026-03-31,3,本餐主食選用全穀類搭配白米，提供纖維與營養。亮點包含多道蔬菜清燙保留礦物質與纖維、海鮮菇湯與玉米蛋花湯清淡保留營養、豆瓣鮮魚搭配豆腐提供優質蛋白。然而，隱憂為部分主菜與副菜選用高加工食材，如咖哩燴冬粉、果香豆腸、紅燒豆包等，營養平衡度不佳，且部分菜餚如椒鹽香酥雞熱量高且營養低。整體屬一般的餐次，建議減少高加工食材的使用，增加清淡烹調的菜餚。,17,"[""胚芽飯"", ""海鮮排"", ""咖哩燴冬粉(素)"", ""果香豆腸(素)"", ""紅燒豆包(素)"", ""豆瓣鮮魚(非基改)"", ""大麥飯"", ""胚芽飯(素)"", ""椒鹽香酥雞"", ""綜合關東煮"", ""鄉村粉絲"", ""酸辣湯(素)"", ""鮮蔬甘藍"", ""和風鮮菇湯"", ""玉米蛋花湯(非基改)"", ""產履油麥菜"", ""油麥菜(履歷)""]"
新北市蘆洲區蘆洲國小,2026-03-31,4,本餐主食、主菜、蔬菜、湯品與水果齊全，搭配均衡。亮點為糙米飯提供纖維與礦物質、多道蔬菜清淡烹調保留營養、水果提供纖維與維生素。隱憂為酥炸蘿蔔糕高加工高熱量，肉絲黃芽加工度較高，建議減少加工食品與油炸頻率。整體屬均衡偏健康的一餐。,11,"[""糙米飯"", ""1150331古早味瓜仔肉"", ""1150331瓜仔干丁(素)"", ""1150331有機小芥菜(素)"", ""1150331紅絲黃芽(素)"", ""1150331肉絲黃芽"", ""1150331蔬菜豆腐湯"", ""1150331酥炸蘿蔔糕(素)"", ""1150331蔬菜蛋花湯"", ""1150331有機小芥菜"", ""1150331水果""]"
新北市蘆洲區鷺江國中,2026-03-31,4,本餐主食、主菜、蔬菜、湯品與副菜齊全，搭配均衡。亮點為紅藜飯提供全谷物纖維，多種蔬菜組合如田園時蔬、履歷油麥菜、福山萵苣等保留營養豐富，薑絲鮮瓜湯與酸菜肉絲湯清淡解膩。隱憂為可樂餅高加工冷凍食品，結菜黑輪高加工高鈉，白飯缺乏蛋白質與纖維，建議減少加工食品與增加全穀主食。整體屬均衡偏健康的一餐。,17,"[""麻油雞"", ""白飯"", ""結菜黑輪"", ""蒸蛋"", ""酸菜肉絲湯"", ""履歷油麥菜"", ""家常豆腐(素1)"", ""紅藜飯"", ""紅藜飯(素)"", ""田園時蔬(1"", ""田園時蔬(素1)"", ""蒜泥白肉"", ""薑絲鮮瓜湯(素)"", ""香滷蘭花干(素1)"", ""薑絲鮮瓜湯"", ""福山萵苣"", ""可樂餅(1""]"
新北市蘆洲區鷺江國小,2026-03-31,4,本餐主食、主菜、副菜、蔬菜、湯品多樣，營養均衡。亮點為糯小米飯、胚芽飯提供纖維，小米飯(素)與白飯搭配平衡，滷香黑干、麻油雞、哨子豆腐、扁豆蔬菜湯等菜餚均富含蛋白質與纖維，有機小芥菜、和風鮮菇湯、筍片排骨湯等保留礦物質與纖維。隱憂為泡菜燒肉、瓜仔肉、海鮮排、起司球等菜餚加工度高或鈉含量偏高，建議減少加工食品與高鈉食材的攝取。整體屬均衡且多樣的一餐。,23,"[""胚芽飯"", ""麻油雞"", ""白飯"", ""酸菜肉絲湯"", ""有機小芥菜"", ""小米飯(素)"", ""哨子豆腐(素)"", ""扁豆蔬菜湯(素)"", ""腐皮白菜(素)"", ""海鮮排"", ""小米飯"", ""蔬炒絲瓜"", ""筍片排骨湯"", ""鮮蔬甘藍"", ""和風鮮菇湯"", ""有機小芥菜(素)"", ""滷香黑干(素)"", ""瓜仔肉"", ""打拋鴿蛋"", ""泡菜燒肉"", ""有機蔬菜小芥菜"", ""起司球x2"", ""結菜煮""]"
新北市貢寮區和美國小,2026-03-31,4,本餐主食、主菜、蔬菜、湯品與水果齊全，搭配均衡。亮點為地瓜白飯提供纖維，清燙有機蔬菜保留礦物質，酸菜豬血湯富含鐵，牛奶提供優質鈣質。隱憂為滷雞翅高鈉，風味料多營養不足，寧波年糕熱量偏高，建議減少滷包與年糕的攝入量。整體屬均衡偏健康的一餐。,6,"[""酸菜豬血湯"", ""滷雞翅"", ""地瓜白飯"", ""寧波年糕"", ""有機蔬菜"", ""牛奶""]"
新北市貢寮區澳底國小,2026-03-31,3,本餐主食地瓜白飯提供複合碳水化合物，搭配優質蛋白與蔬菜，但主菜滷雞翅與副菜寧波年糕高鈉與加工料偏多。亮點為有機蔬菜清燙保留纖維，牛奶提供優質蛋白與鈣質。隱憂為滷包與年糕高鈉，酸菜豬血湯使用高鮮味精，建議減少滷包與年糕的使用量，選用低鈉調味料。整體屬一般的一餐，需要調整部分料理手法與食材以達均衡營養。,6,"[""滷雞翅"", ""地瓜白飯"", ""寧波年糕"", ""酸菜豬血湯"", ""有機蔬菜"", ""牛奶""]"
新北市貢寮區福連國小,2026-03-31,4,本餐主食、主蛋白、蔬菜、湯品與水果齊全，搭配較為均衡。亮點為全穀糙米白飯提供纖維與礦物質、有機蔬菜清燙保留營養、酸菜豬血湯富含鐵與維生素、水果提供新鮮維生素與礦物質。隱憂為滷雞翅與寧波年糕鈉與碳水含量略高，建議適量控制食用。整體屬偏健康的一餐，均衡度尚可，但仍需注意調整部分菜餚的烹調方法與食材選擇。,6,"[""糙米白飯"", ""寧波年糕"", ""酸菜豬血湯"", ""滷雞翅"", ""有機蔬菜"", ""水果""]"
