"33931011","大明彈簧股份有限公司","新北市土城區中華路2段92之1號","10000000","10000000"," ","0640324","新北市土城區中華路２段９２之１號","259212,464211,,","26-MAR-26","","","","",""
"34007426","集大分裝場股份有限公司","新北市五股區民義路1段287巷9號","14000000","14000000"," ","0641211","新北市五股區民義路１段２８７巷９號","352000,463112,,","26-MAR-26","","","","",""
"34182958","東亞通信工業股份有限公司","新北市樹林區中正路753號","200000000","200000000"," ","0581014","新北市樹林區三龍里中正路７５３號","293600,272112,681112,465311","26-MAR-26","","","","東亞,TONGYA,","2024-11-27"
"34352735","泓音電子有限公司","新北市新店區民權路153號5樓","10000000"," "," ","0680411","新北市新店區江陵里民權路１５３號５樓","456111,,,","26-MAR-26","","","","HARMONY,泓音,","2024-11-27"
"34440082","鹿友實業股份有限公司","新北市板橋區文化路2段488號4樓之1","19000000","19000000"," ","0700213","新北市板橋區文翠里文化路２段４８８號４樓之１","530100,340099,712999,","26-MAR-26","","","","",""
"34449921","承甫科技工業股份有限公司","新北市新店區安德街160號","15000000","15000000"," ","0700601","新北市新店區安德街１６０號","292912,483111,291900,184199","26-MAR-26","","","","",""
"34542481","自強工程顧問有限公司","新北市中和區新民街112號5樓","50000000"," "," ","0731026","新北市中和區員山里新民街１１２號５樓","439099,422017,711299,639099","26-MAR-26","","","","LEADSURVEY,","2024-11-27"
"34573499","川菱工業股份有限公司","新北市五股區五權八路48號","100000000","59047800"," ","0720510","新北市五股區五權八路４８號","433211,464920,,","26-MAR-26","","","","",""
"34581884","原泉水電工程有限公司","新北市林口區文化北路1段317號3樓","14000000"," "," ","0720610","新北市林口區南勢里文化北路１段３１７號３樓","433111,433900,461515,","26-MAR-26","","","","",""
"34637085","偉貿企業有限公司","新北市中和區連城路60號2樓","15000000"," "," ","0720614","新北市中和區連和里連城路６０號２樓","464999,464111,,","26-MAR-26","","","","",""
"34728655","久大機械鑿井有限公司","新北市中和區泰和街41號3樓","12000000"," "," ","0740415","新北市中和區泰和街４１號３樓","433212,422017,340099,433199","26-MAR-26","","","","",""
"35042202","大德機械工程股份有限公司","新北市三重區光復路2段50號","100000000","100000000"," ","0541227","新北市三重區光復路２段５０號","291900,253112,,","26-MAR-26","","","","TTS,TATE,大德,TA,","2024-11-27"
"35160426","雲平煤氣有限公司","新北市板橋區德興街32號","1200000"," "," ","0581208","新北市板橋區華德里德興街３２號","482912,,,","26-MAR-26","","","","",""
"35894976","百合綠能印刷股份有限公司","新北市淡水區中正東路2段77之1號20樓","5000000","5000000"," ","0670220","新北市淡水區中正東路２段７７之１號２０樓","160100,433900,,","26-MAR-26","","","","",""
"36055680","至盛工業股份有限公司","新北市新莊區中正路316號11樓","100000000","100000000"," ","0700514","新北市新莊區全泰里中正路３１６號１１樓","293311,253999,291900,284299","26-MAR-26","","","","日盛,","2024-11-27"
"36083932","印泉企業有限公司","新北市新莊區新泰路199巷19號1樓","500000"," "," ","0701221","新北市新莊區新泰路１９９巷１９號","462013,453212,292999,","26-MAR-26","","","","潔酒,","2024-11-27"
"36147957","史業有限公司","新北市蘆洲區中山一路294號","10000000"," "," ","0720210","新北市蘆洲區得仁里中山一路２９４號","293999,281099,259100,251199","26-MAR-26","","","","","2024-11-27"
"36250847","霖昌實業有限公司","新北市林口區工九路14號1樓","77860913"," "," ","0721129","新北市林口區東林里工九路１４號","253112,353011,433212,293700","26-MAR-26","","","","霖昌,L,","2024-11-27"
"37074708","協溢汽車股份有限公司","新北市淡水區中正東路2段27之9號3樓","26000000","26000000"," ","0551110","新北市淡水區中正東路２段２７之９號３樓","493200,494099,,","26-MAR-26","","","","",""
"37154574","萬美觀光事業股份有限公司","新北市萬里區瑪鍊路262號","6000000","1500000"," ","0570515","新北市萬里區萬里里瑪鋉路２６２號","551012,932914,561115,","26-MAR-26","","","","WHITE HOUSE,WHITE HOUSE RESORT,白宮行館,","2024-11-27"
"37507297","寶琦工程有限公司","新北市石門區老梅路52巷4號","10000000"," "," ","0711202","新北市石門區老梅路５２巷４號","811000,,,","26-MAR-26","","","","",""
"38001465","高興能源股份有限公司","新北市新店區安康路3段628號","100000000","100000000"," ","0830924","新北市新店區安康路３段６２８號","463112,482912,,","26-MAR-26","","","","",""
"38059959","協芳煤氣有限公司","新北市新店區光明街91號","1000000"," "," ","0600415","新北市新店區光明街９１號","482912,422016,433212,","26-MAR-26","","","","",""
"38401949","東周化學工業股份有限公司","新北市新店區二十張路25巷18弄18號5樓","230000000","230000000"," ","0700422","新北市新店區二十張路２５巷１８弄１８號５樓","192011,199012,461400,184199","26-MAR-26","","","","金甲巧當家,一炭就淨,喜耐斯,金甲大管家,壁治妥,金甲,喜奈士,KINGFIRST,KEN JEA,SINICE,金甲好專家,東周,FLAWLESS GENIUS,","2024-11-27"
"38440957","長虹電子有限公司","新北市中和區建八路16號16樓之4","10000000"," "," ","0730821","新北市中和區平河里建八路１６號１６樓之４","464211,269999,,","26-MAR-26","","","","SEP,","2024-11-27"
"42568272","禾豐太陽能源科技有限公司","新北市新莊區成德街13號5樓","10000000"," "," ","1040611","新北市新莊區四維里成德街１３號５樓","772100,465311,465314,484111","26-MAR-26","","","","",""
"42586031","摩爾創新科技股份有限公司","新北市板橋區民生路3段32號27樓之3","20000000","15020000"," ","1040803","新北市板橋區聯翠里民生路３段３２號２７樓之３","464211,433212,433113,433115","26-MAR-26","","","","MOORETEC,","2024-11-27"
"42590598","毓順科技股份有限公司","新北市林口區粉寮路1段7號","300000000","235700000"," ","1040818","新北市林口區林口里粉寮路１段７號","433199,433212,433117,469199","26-MAR-26","","","","",""
"42591816","佰業休閒開發有限公司","新北市新莊區榮華路2段83號12樓","80000000"," "," ","1040821","新北市新莊區中原里榮華路２段８３號１２樓","702099,551012,932999,471999","26-MAR-26","","","","",""
"42620523","唯一八煙股份有限公司","新北市金山區林口35號","200000000","50000000"," ","1040715","新北市金山區林口３５號","561115,562099,,","26-MAR-26","","","","",""
"42621473","一一科技有限公司","新北市中和區景平路241巷24號(1樓)","14000000"," "," ","1040717","新北市中和區景福里景平路２４１巷２４號１樓","610999,292800,649999,620211","26-MAR-26","","","","",""
"42626152","德宜方有限公司","新北市三重區福德南路52號10樓","500000"," "," ","1040730","新北市三重區清和里福德南路５２號１０樓","456213,463112,469925,456111","26-MAR-26","","","","",""
"42628102","長佳生物科技股份有限公司","新北市新店區莒光路87巷22號","10000000","10000000"," ","1040804","新北市新店區下城里莒光路８７巷２２號","472999,454999,,","26-MAR-26","","","","",""
"42651145","極吉能源發展股份有限公司","新北市新店區莒光路87巷22號","190000000","78357450"," ","1041014","新北市新店區下城里莒光路８７巷２２號","456112,464211,,","26-MAR-26","","","","",""
"42690528","有慶興業有限公司","新北市深坑區北深路3段270巷8號6樓","5000000"," "," ","1041109","新北市深坑區萬福里北深路３段２７０巷８號６樓","433211,464999,,","26-MAR-26","","","","",""
"42694242","吉祐有限公司","新北市泰山區全興路全福巷24之2號(3樓)","2500000"," "," ","1041126","新北市泰山區福興里全興路全福巷２４之２號（３樓）","434011,434013,434015,","26-MAR-26","","","","",""
"42694550","尚峰資訊科技有限公司","新北市新莊區萬安街87巷11號","1000000"," "," ","1041127","新北市新莊區萬安里萬安街８７巷１１號","464299,,,","26-MAR-26","","","","",""
"42694572","北昌有限公司","新北市新莊區中正路887之12號3樓","2000000"," "," ","1041127","新北市新莊區裕民里中正路８８７─１２號３樓","351000,360000,353011,422014","26-MAR-26","","","","",""
"42694876","尚發精密股份有限公司","新北市板橋區金門街151巷5弄7號3樓","10000000","10000000"," ","1041130","新北市板橋區成和里金門街１５１巷５弄７號３樓","952312,433115,434011,","26-MAR-26","","","","",""
"42696699","南章科技有限公司","新北市新店區安祥路110巷29號13樓","3000000"," "," ","1041209","新北市新店區香坡里安祥路１１０巷２９號１３樓","639099,,,","26-MAR-26","","","","",""
"42699204","信眾資產管理股份有限公司","新北市三重區三民街146巷4號","20000000","20000000"," ","1041221","新北市三重區田心里三民街１４６巷４號","464999,669199,702099,670012","26-MAR-26","","","","",""
"42700309","天瑞能源有限公司","新北市汐止區新台五路1段75號13樓之2","18000000"," "," ","1041225","新北市汐止區復興里新台五路一段７５號十三樓之２","351000,281099,269999,353011","26-MAR-26","","","","",""
"42701089","榮全能源科技有限公司","新北市蘆洲區中山一路161號3樓","1000000"," "," ","1041231","新北市蘆洲區溪墘里中山一路１６１號３樓","433199,454999,,","26-MAR-26","","","","",""
"42703170","錦德鋼鐵股份有限公司","新北市板橋區文化路2段88號6樓","100000000","60000000"," ","1050112","新北市板橋區莒光里文化路２段８８號６樓","469925,461599,461512,461999","26-MAR-26","","","","JD,錦德集團,","2024-11-27"
"42704950","無雙界股份有限公司","新北市永和區豫溪街191巷7弄31號","2500000","2500000"," ","1050119","新北市永和區桂林里豫溪街１９１巷７弄３１號","812999,020011,422099,711299","26-MAR-26","","","","",""
"42708415","標捷綠能股份有限公司","新北市三重區重新路4段97號9樓之1","64614990","64614990"," ","1050203","新北市三重區福祉里重新路４段９７號９樓之１","353011,,,","26-MAR-26","","","","",""
"42711002","原色國際時尚有限公司","新北市淡水區濱海路1段416號2樓","1000000"," "," ","1050224","新北市淡水區濱海路１段４１６號２樓","434011,,,","26-MAR-26","","","","",""
"42711122","冠帝工程有限公司","新北市淡水區民族路110巷42號","300000"," "," ","1050225","新北市淡水區民權里民族路１１０巷４２號","422013,,,","26-MAR-26","","","","",""
"42711431","邁冷空調材料有限公司","新北市淡水區淡金路16巷99號9樓","3000000"," "," ","1050226","新北市淡水區淡金路１６巷９９號９樓","456114,433211,,","26-MAR-26","","","","",""
"42711973","北辰實業有限公司","新北市三重區中興北街132之6號9樓","1000000"," "," ","1050301","新北市三重區中興里中興北街１３２之６號９樓","433112,433115,433900,","26-MAR-26","","","","",""
"42716127","佳時丞有限公司","新北市三峽區中華路43巷6號2樓","1000000"," "," ","1050317","新北市三峽區安溪里中華路４３巷６號二樓","464299,,,","26-MAR-26","","","","",""
"42717717","全國有限公司","新北市樹林區光興街294號","1000000"," "," ","1050324","新北市樹林區光興里光興街２９４號","011999,011399,011699,011799","26-MAR-26","","","","",""
"42720115","睿昱工程有限公司","新北市蘆洲區民生街8號5樓","2000000"," "," ","1070503","新北市蘆洲區民和里民生街８號５樓","434011,461311,433199,464299","26-MAR-26","","","","",""
"42723648","巨森企業有限公司","新北市三重區自強路4段3巷29號（1樓）","5000000"," "," ","1070517","新北市三重區福隆里自強路４段３巷２９號（１樓）","269999,484311,,","26-MAR-26","","","","",""
"42725110","紫崧能源有限公司","新北市三重區重新路4段87號10樓","11000000"," "," ","1070523","新北市三重區福祉里重新路４段８７號１０樓","433116,456111,712999,631299","26-MAR-26","","","","",""
"42727813","未來服務工業股份有限公司","新北市新莊區建安街71巷17號5樓","20000000","14700000"," ","1070605","新北市新莊區建安里建安街７１巷１７號５樓","292999,464915,340017,771999","26-MAR-26","","","","",""
"42728571","寶芃有限公司","新北市新店區安康路2段107巷9號","1000000"," "," ","1070607","新北市新店區公崙里安康路２段１０７巷９號","454700,,,","26-MAR-26","","","","",""
"42729179","晟煬興業有限公司","新北市樹林區中正路47號10樓","100000"," "," ","1070608","新北市樹林區圳福里中正路４７號１０樓","281099,433212,456199,681112","26-MAR-26","","","","",""
"42729354","翊權實業有限公司","新北市汐止區大同路3段196之5號8樓","1000000"," "," ","1070611","新北市汐止區保安里大同路三段１９６─５號８樓","464211,220912,,","26-MAR-26","","","","",""
"42731909","泓錡消防有限公司","新北市中和區中山路2段332巷17號2樓","100000"," "," ","1070622","新北市中和區中原里中山路２段３３２巷１７號２樓","433212,433115,,","26-MAR-26","","","","",""
"42732885","勝德空壓機械股份有限公司","新北市新莊區中港路591巷23號","20000000","8000000"," ","1070627","新北市新莊區中信里中港路５９１巷２３號","292999,464499,340017,771999","26-MAR-26","","","","",""
"42733097","信捷科技工程有限公司","新北市汐止區民族五街8號8樓之3","3000000"," "," ","1070629","新北市汐止區金龍里民族五街８號８樓之３","433212,,,","26-MAR-26","","","","",""
"42733961","鑫陽開發有限公司","新北市板橋區五權街32巷8號","12200000"," "," ","1070703","新北市板橋區五權里五權街３２巷８號","281099,670011,465311,433900","26-MAR-26","","","","",""
"42736735","捷笙能源有限公司","新北市新莊區民安路181巷2弄8號(1樓)","7500000"," "," ","1070717","新北市新莊區建安里民安路１８１巷２弄８號（１樓）","464211,,,","26-MAR-26","","","","",""
"42738749","大昇能源科技有限公司","新北市新店區中央路155號15樓之9","40000000"," "," ","1070725","新北市新店區福民里中央路１５５號１５樓之９","351000,,,","26-MAR-26","","","","",""
"42743813","聯利新能源有限公司","新北市新店區中央路155號15樓之9","5000000"," "," ","1041105","新北市新店區福民里中央路１５５號１５樓之９","351000,,,","26-MAR-26","","","","",""
"42774879","宗陽能源股份有限公司","新北市新莊區中正路651號4樓","20000000","2000000"," ","1050217","新北市新莊區福營里中正路６５１號４樓","289099,,,","26-MAR-26","","","","",""
"42809032","汯裕工程有限公司","新北市林口區麗園一街2巷1號13樓之4","3000000"," "," ","1070214","新北市林口區麗園里麗園一街２巷１號１３樓之４","433212,,,","26-MAR-26","","","","",""
"42819003","稷原綠能股份有限公司","新北市汐止區新台五路1段102號6樓","10000000","10000000"," ","1070504","新北市汐止區文化里新台五路一段１０２號六樓","281099,351000,433199,269999","26-MAR-26","","","","",""
"42822746","譽宸有限公司","新北市淡水區吳仔厝17號","5000000"," "," ","1041113","新北市淡水區吳仔厝１７號","812999,813000,631299,453211","26-MAR-26","","","","",""
"42825069","路克能源有限公司","新北市新店區溪園路499號12樓","750000"," "," ","1041119","新北市新店區中山里溪園路４９９號１２樓","760999,,,","26-MAR-26","","","","",""
"42856718","安欣能源科技股份有限公司","新北市新店區寶強路16號13樓","30000000","20000000"," ","1050304","新北市新店區寶興里寶強路１６號１３樓","281099,353011,760999,681113","26-MAR-26","","","","",""
"42868587","三傑物聯科技股份有限公司","新北市三重區光復路1段61巷27號3樓之3","100000000","50000000"," ","1050803","新北市三重區五谷里光復路１段６１巷２７號３樓之３","464211,631299,620212,","26-MAR-26","","","","",""
"42961129","鑫毅綠能有限公司","新北市林口區南勢街250巷5號5樓","2000000"," "," ","1070518","新北市林口區南勢里南勢街２５０巷５號５樓","433199,760999,,","26-MAR-26","","","","",""
"42976333","光碩能源有限公司","新北市三重區興德路123之3號8樓","30000000"," "," ","1070725","新北市三重區中興里興德路１２３之３號８樓","760999,340099,,","26-MAR-26","","","","",""
"42980596","霖月能源科技股份有限公司","新北市新莊區新北大道3段161號19樓","10000000","6000000"," ","1070814","新北市新莊區中隆里新北大道３段１６１號１９樓","433199,351000,433900,340015","26-MAR-26","","","","",""
"42988197","城八能源有限公司","新北市林口區吉祥路195號14樓","40000000"," "," ","1070920","新北市林口區湖南里吉祥路１９５號１４樓","813000,,,","26-MAR-26","","","","",""
"43647459","寶隆室內工藝股份有限公司","新北市鶯歌區八德路1號","650000000","210010000"," ","0620926","新北市鶯歌區尖山里八德路１號","454611,232212,434013,434011","26-MAR-26","","","","",""
"43799321","詮鎔有限公司","新北市蘆洲區長榮路166之1號3樓","6000000"," "," ","1050506","新北市蘆洲區正義里長榮路１６６之１號３樓","702099,,,","26-MAR-26","","","","",""
"43805626","亞譽國際數位科技有限公司","新北市永和區秀朗路2段76號","1150000"," "," ","1050510","新北市永和區秀林里秀朗路２段７６號","433211,483111,464913,","26-MAR-26","","","","",""
"43832594","惠捷顧問股份有限公司","新北市林口區忠孝路545號（2樓）","300000000","38700000"," ","1050520","新北市林口區麗園里忠孝路５４５號（２樓）","351000,,,","26-MAR-26","","","","",""
"43939809","元記實業股份有限公司","新北市鶯歌區鶯桃路479號(1樓)","15000000","15000000"," ","0740201","新北市鶯歌區鳳祥里鶯桃路４７９號（１樓）","461213,239915,461214,463999","26-MAR-26","","","","",""
"43942419","堡城國際有限公司","新北市汐止區新台五路1段97號27樓之7","1270000"," "," ","1050701","新北市汐止區復興里新台五路一段９７號二十七樓之７","433116,433115,433114,433199","26-MAR-26","","","","",""
"45019314","奧岑綠能開發股份有限公司","新北市汐止區新台五路1段99號8樓之2","25000000","25000000"," ","1050719","新北市汐止區復興里新台五路一段９９號八樓之２","723000,,,","26-MAR-26","","","","",""
"45141080","新維科技工程有限公司","新北市新店區北新路二段262號3樓之3","1000000"," "," ","1050627","新北市新店區寶興里北新路２段２６２號３樓之３","390011,340099,,","26-MAR-26","","","","",""
"45899232","子晶綠能科技股份有限公司","新北市新莊區中正路853之1號(1樓)","60000000","60000000"," ","1050328","新北市新莊區富國里中正路８５３之１號（１樓）","281099,269999,,","26-MAR-26","","","","DC DAUGHTER CRYSTAL,子晶,","2024-11-27"
"45902399","東勁昌有限公司","新北市新店區檳榔路36巷6號2樓","1000000"," "," ","1050401","新北市新店區文明里檳榔路３６巷６號２樓","464999,,,","26-MAR-26","","","","",""
"45908181","嘉興國際企業有限公司","新北市樹林區鎮前街347巷3弄28號2樓","200000"," "," ","1050414","新北市樹林區東昇里鎮前街３４７巷３弄２８號２樓","291900,293499,,","26-MAR-26","","","","",""
"45908400","基合能源科技有限公司","新北市新莊區中和街155巷36號","500000"," "," ","1050414","新北市新莊區中和街１５５巷３６號","281099,464999,434099,681113","26-MAR-26","","","","",""
"46084707","瑞松花園廣埸水業有限公司","新北市汐止區瑞松街150巷20號4樓之20","500000"," "," ","1050426","新北市汐止區烘內里瑞松街１５０巷２０號四樓之２０","433212,,,","26-MAR-26","","","","",""
"46158411","啟豐實業有限公司","新北市蘆洲區中山二路33巷11號","5000000"," "," ","1050429","新北市蘆洲區溪墘里中山二路３３巷１１號","433211,485113,,","26-MAR-26","","","","",""
"46185249","動能機電工程股份有限公司","新北市三重區重新路5段609巷6號6樓","45000000","45000000"," ","1050503","新北市三重區重新路５段６０９巷６號６樓","433117,464111,464211,464999","26-MAR-26","","","","",""
"46359347","大漢建設股份有限公司","新北市永和區保生路1號15樓","95000000","95000000"," ","1010113","新北市永和區保安里保生路１號１５樓","670012,681112,,","26-MAR-26","","","","",""
"46359894","集光環能開發有限公司","新北市三峽區愛國路182號12樓","4000000"," "," ","1050512","新北市三峽區礁溪里０３６鄰愛國路１８２號１２樓","293999,,,","26-MAR-26","","","","",""
"46377106","天心室內裝修有限公司","新北市板橋區大觀路2段19巷103之1號","1010000"," "," ","1050513","新北市板橋區中山里大觀路二段１９巷１０３之１號","434011,434015,,","26-MAR-26","","","","",""
"46456410","永宸技術顧問有限公司","新北市永和區保生路2號16樓之1","1000000"," "," ","1050518","新北市永和區保安里保生路２號１６樓之１","702099,631299,711299,431099","26-MAR-26","","","","",""
"46459079","芃宇生技股份有限公司","新北市新店區北新路2段173號9樓","5000000","5000000"," ","1050519","新北市新店區明德里北新路２段１７３號９樓","454999,456700,,","26-MAR-26","","","","PY,","2024-11-27"
"46647170","台灣瑞琜有限公司","新北市中和區安平路198巷2號5樓","3000000"," "," ","1050531","新北市中和區安樂里安平路１９８巷２號５樓","269999,433199,620211,483111","26-MAR-26","","","","",""
"47024073","月色貿易有限公司","新北市中和區景平路429號3樓之5","500000"," "," ","1050608","新北市中和區新南里景平路４２９號３樓之５","454999,461999,,","26-MAR-26","","","","",""
"47038956","世陽國際能源股份有限公司","新北市三重區重新路4段97號9樓之1","16883470","6883470"," ","1050614","新北市三重區福祉里重新路４段９７號９樓之１","353011,,,","26-MAR-26","","","","",""
"47040334","清文營造工程事業有限公司","新北市新莊區龍安路278巷1號2樓","3600000"," "," ","1050615","新北市新莊區成德里龍安路２７８巷１號２樓","434011,433212,410011,","26-MAR-26","","","","",""
"47053055","聯富智能工程有限公司","新北市中和區復興路43號","2000000"," "," ","1050620","新北市中和區外南里復興路４３號","439099,434012,,","26-MAR-26","","","","",""
"47073340","德川思創有限公司","新北市土城區青仁路42號(1樓)","5500000"," "," ","1050701","新北市土城區清水里青仁路４２號（１樓）","474111,,,","26-MAR-26","","","","",""
"47085681","全國氣體有限公司","新北市樹林區光興街294號","1000000"," "," ","1050715","新北市樹林區光興里光興街２９４號","462099,,,","26-MAR-26","","","","",""
"47091656","廣稷有限公司","新北市林口區文化三路2段41巷52號8樓","72000000"," "," ","1050722","新北市林口區湖南里文化三路二段４１巷５２號８樓","351000,,,","26-MAR-26","","","","",""
"47096569","卡爾曼能源管理顧問有限公司","新北市三峽區國光街334號","3300000"," "," ","1050727","新北市三峽區龍埔里國光街３３４號","456700,474116,340015,","26-MAR-26","","","","",""
"47101774","台灣菁品開拓有限公司","新北市板橋區吳鳳路50巷75弄12號3樓","5000000"," "," ","1050801","臺北市松山區敦化里敦化南路１段７號５樓","471999,487912,,","26-MAR-26","","","","",""
"47118509","微司特環保科技有限公司","新北市新店區安康路3段51號4樓","100000"," "," ","1050811","新北市新店區雙城里安康路３段５１號４樓","464299,340099,,","26-MAR-26","","","","",""
"50763538","巧達雲端科技有限公司","新北市汐止區新台五路1段104號17樓之1","5000000"," "," ","1070425","新北市汐止區文化里新台五路一段１０４號１７樓之１","464211,,,","26-MAR-26","","","","",""
"50788398","巨光能源科技有限公司","新北市新店區中央路155號15樓之9","50000000"," "," ","1070629","新北市新店區福民里中央路１５５號１５樓之９","351000,,,","26-MAR-26","","","","ENNEA SOLAR,巨光能源,","2024-11-27"
"50799064","太能系統股份有限公司","新北市三重區重新路5段609巷2之6號","600000000","110500000"," ","1070731","新北市三重區重新路５段６０９巷２之６號","281099,269999,433199,464299","26-MAR-26","","","","太能系統,S,PACIFIC SMART SYSTEM,","2024-11-27"
"50799079","亞鼎能源有限公司","新北市三重區重新路5段609巷2-6號","500000"," "," ","1070731","新北市三重區重新路５段６０９巷２之６號","351000,,,","26-MAR-26","","","","",""
"50841339","小農再生能源有限公司","新北市中和區中正路464號","1000000"," "," ","1070803","新北市中和區中山里中正路４６４號","353011,,,","26-MAR-26","","","","",""
