"60555106","台灣鑽井股份有限公司","新北市新店區北新路3段217號9樓","2000000000","300000"," ","1140806","新北市新店區復興里北新路３段２１７號９樓","422017,431020,,","26-MAR-26","","","","",""
"60555154","宏豐能源股份有限公司","新北市三重區安慶街361巷2號4樓","20000000","1000000"," ","1140806","新北市三重區幸福里安慶街３６１巷２號４樓","351000,,,","26-MAR-26","","","","",""
"60562774","梗生有限公司","新北市板橋區中山路1段1號23樓","200000"," "," ","1140820","新北市板橋區鄉雲里中山路一段１號２３樓","433212,,,","26-MAR-26","","","","",""
"60563302","旯晟開發有限公司","新北市瑞芳區三爪子坑路29巷58號2樓","6500000"," "," ","1140822","新北市瑞芳區三爪子坑路２９巷５８號２樓","670011,670012,524100,","26-MAR-26","","","","",""
"60569333","興品實業股份有限公司","新北市新店區寶橋路235巷118號5樓之1","1000000","1000000"," ","1140829","新北市新店區寶福里寶橋路２３５巷１１８號５樓之１","463911,,,","26-MAR-26","","","","",""
"60569880","兆豐資產有限公司","新北市板橋區文化路2段441巷2弄6號","2000000"," "," ","1140902","新北市板橋區柏翠里文化路２段４４１巷２弄６號","670012,561115,,","26-MAR-26","","","","",""
"60573097","佳捷智能股份有限公司","新北市新莊區中環路3段200號18樓","200000000","50000000"," ","1140603","新北市新莊區中原里中環路３段２００號１８樓","292999,,,","26-MAR-26","","","","",""
"60574069","揚昇熙泉有限公司","新北市新莊區榮華路2段115號6樓","100000"," "," ","1140605","新北市新莊區榮華路２段１１５號６樓","464999,,,","26-MAR-26","","","","",""
"60574119","喆德新能源股份有限公司","新北市新店區寶橋路235巷138號8樓","1000000","100000"," ","1140605","新北市新店區寶福里寶橋路２３５巷１３８號８樓","760999,433199,,","26-MAR-26","","","","",""
"60580597","天光清能股份有限公司","新北市新莊區福樂街96號(1樓)","1200000","1200000"," ","1140709","新北市新莊區仁義里福樂街９６號（１樓）","433900,433199,,","26-MAR-26","","","","",""
"60595037","王鼎鍋物有限公司","新北市林口區忠孝路509號","1000000"," "," ","1140826","新北市林口區仁愛里忠孝路５０９號","561115,,,","26-MAR-26","","","","",""
"60595254","天靜能源股份有限公司","新北市林口區公園路203號4樓之1及之２","20000000","1000000"," ","1140827","新北市林口區仁愛里公園路２０３號４樓之１至之２","433199,,,","26-MAR-26","","","","",""
"60601663","禾祤科技有限公司","新北市板橋區中山路1段1號23樓","1000000"," "," ","1140904","新北市板橋區鄉雲里中山路１段１號２３樓","712100,,,","26-MAR-26","","","","",""
"60602136","金碖科技有限公司","新北市汐止區新台五路1段93號21樓之6","870000"," "," ","1140909","新北市汐止區復興里新台五路一段９３號二十一樓之６","433199,711299,,","26-MAR-26","","","","",""
"60603108","騰曜電業股份有限公司","新北市板橋區三民路1段122號8樓","1000000","1000000"," ","1140912","新北市板橋區雙玉里三民路１段１２２號８樓","292999,433900,,","26-MAR-26","","","","",""
"60604887","申川馬股份有限公司","新北市中和區中正路782號7樓","300000000","15000000"," ","1140613","新北市中和區平河里中正路７８２號７樓","461515,464999,,","26-MAR-26","","","","",""
"60605324","筑崌有限公司","新北市鶯歌區龍七路275號8樓","1000000"," "," ","1140616","新北市鶯歌區鳳鳴里龍七路２７５號８樓","454512,464111,471999,434011","26-MAR-26","","","","",""
"60617314","沄洛股份有限公司","新北市汐止區新台五路1段90號20樓","100000000","1000000"," ","1140721","新北市汐止區文化里新台五路一段９０號二十樓","433212,433115,433111,","26-MAR-26","","","","",""
"60617665","竹輪智能移動股份有限公司","新北市三重區福德北路4號","50000000","10000000"," ","1140722","新北市三重區光華里福德北路４號","484211,,,","26-MAR-26","","","","",""
"60625953","愷辰工程有限公司","新北市新莊區新知三路61號3樓","300000"," "," ","1140807","新北市新莊區福基里新知三路６１號３樓","434013,,,","26-MAR-26","","","","",""
"60625996","必勝能源股份有限公司","新北市三峽區學成路157號2樓","1000000","1000000"," ","1140807","新北市三峽區學成路１５７號２樓","456199,,,","26-MAR-26","","","","",""
"60627116","富謙國際有限公司","新北市中和區中興街115巷4號","5000000"," "," ","1140825","新北市中和區復興里中興街１１５巷４號","782000,781099,,","26-MAR-26","","","","",""
"60632504","山姆運動有限公司","新北市土城區金城路1段58號5樓之5","2000000"," "," ","1140915","新北市土城區埤塘里金城路１段５８號５樓之５","702099,931299,931999,","26-MAR-26","","","","",""
"60632547","宣鉦股份有限公司","新北市萬里區磺潭里坪頂3號","500000","500000"," ","1140915","新北市萬里區磺潭里坪頂３號","422017,464999,340099,433199","26-MAR-26","","","","",""
"60633074","麒淵工程有限公司","新北市板橋區溪崑二街112巷33弄18號5樓","2000000"," "," ","1140917","新北市板橋區溪洲里溪崑二街１１２巷３３弄１８號五樓","433111,464920,,","26-MAR-26","","","","",""
"60633715","加芬物業有限公司","新北市新莊區新泰路305巷3號地下一樓","1000000"," "," ","1140919","新北市新莊區立泰里新泰路３０５巷３號地下１樓","433199,,,","26-MAR-26","","","","",""
"60636537","廣晨工程有限公司","新北市汐止區新台五路1段93號21樓之6","3000000"," "," ","1140616","新北市汐止區復興里新台五路一段９３號二十一樓之６","433111,433212,,","26-MAR-26","","","","",""
"60637037","昕富電力有限公司","新北市蘆洲區中山二路48號","1000000"," "," ","1140620","新北市蘆洲區中山二路４８號","760999,,,","26-MAR-26","","","","",""
"60637058","曜熙科技股份有限公司","新北市汐止區大同路3段192號9樓","200000000","1000000"," ","1140619","新北市汐止區保安里大同路三段１９２號九樓","289099,462099,281099,","26-MAR-26","","","","",""
"60637183","加利防災科技有限公司","新北市三重區仁興街28巷13號5樓","2000000"," "," ","1140619","新北市三重區瑞德里仁興街２８巷１３號５樓","433115,464913,,","26-MAR-26","","","","",""
"60637331","宇盾能源股份有限公司","新北市三重區和平街18號","800000","800000"," ","1140619","新北市三重區福星里和平街１８號","464211,464212,464920,464999","26-MAR-26","","","","",""
"60637368","昕宇電力有限公司","新北市蘆洲區中山二路48號","1000000"," "," ","1140619","新北市蘆洲區中山二路４８號","760999,,,","26-MAR-26","","","","",""
"60643517","建南瓦斯企業有限公司","新北市三峽區和平街24號（1樓）","2400000"," "," ","1140624","新北市三峽區永?里和平街２４號（１樓）","433212,482912,,","26-MAR-26","","","","",""
"60643679","幫管修股份有限公司","新北市板橋區大觀路2段20巷8弄2號","500000","162000"," ","1140625","新北市板橋區復興里大觀路２段２０巷８弄２號","812100,433211,782000,","26-MAR-26","","","","",""
"60643782","瓦拉米股份有限公司","新北市新店區北新路1段89號6樓之2","100000","100000"," ","1140626","新北市新店區張南里北新路１段８９號６樓之２","464920,760999,,","26-MAR-26","","","","",""
"60644065","芸緹有限公司","新北市林口區文化三路2段41巷52號8樓","3100000"," "," ","1140626","新北市林口區湖南里文化三路２段４１巷５２號８樓","452000,471999,,","26-MAR-26","","","","",""
"60649174","品侑企業有限公司","新北市五股區新五路2段500號","1000000"," "," ","1140723","新北市五股區成泰里新五路二段５００號","463999,461599,,","26-MAR-26","","","","",""
"60649364","基迪有限公司","新北市板橋區中山路1段10號11樓","10000000"," "," ","1140724","新北市板橋區景星里中山路一段１０號１１樓","464211,464111,,","26-MAR-26","","","","",""
"60649701","兆鴻健康事業有限公司","新北市萬里區萬里加投211號2樓","1000000"," "," ","1140725","新北市萬里區萬里加投２１１號２樓","454812,472918,454811,487213","26-MAR-26","","","","",""
"60650538","上盟國際科技有限公司","新北市土城區青隆街236號6樓","5000000"," "," ","1140729","新北市土城區青隆街２３６號６樓","433199,433116,,","26-MAR-26","","","","",""
"60657981","禾友機電有限公司","新北市新店區如意街24號地下一層之2","100000"," "," ","1140812","新北市新店區玫瑰里如意街２４號地下一層之２","353011,433199,433115,433113","26-MAR-26","","","","",""
"60658623","彩電國際股份有限公司","新北市五股區四維路30巷34弄10號(1樓)","15000000","5000000"," ","1140814","新北市五股區四維路３０巷３４弄１０號（１樓）","170099,,,","26-MAR-26","","","","",""
"60658715","恩沐本質股份有限公司","新北市新店區北新路3段212號(3樓)","2000000","2000000"," ","1140814","新北市新店區寶安里北新路３段２１２號（３樓）","760999,,,","26-MAR-26","","","","",""
"60658757","謹陽工程有限公司","新北市汐止區汐萬路2段66巷130弄16號","2000000"," "," ","1140814","新北市汐止區拱北里汐萬路二段６６巷１３０弄１６號","433111,,,","26-MAR-26","","","","",""
"60674807","曜郅能源有限公司","新北市五股區成泰路3段577巷80弄68號3樓","800000"," "," ","1140317","新北市五股區集賢里成泰路３段５７７巷８０弄６８號３樓","433212,433115,433900,","26-MAR-26","","","","",""
"60684431","靳安國際有限公司","新北市三重區新北大道1段123號11樓","5000000"," "," ","0990528","新北市三重區光陽里０３０鄰新北大道１段１２３號１１樓","452000,,,","26-MAR-26","","","","",""
"60684896","鑫銓工程有限公司","新北市中和區大勇街27巷7號4樓","2000000"," "," ","1140331","新北市中和區秀明里大勇街２７巷７號４樓","434011,433111,,","26-MAR-26","","","","",""
"60684930","雅斤科技工程有限公司","新北市新莊區五權一路1號8樓之1","3000000"," "," ","1140331","新北市新莊區福興里五權一路１號８樓之１","464920,289099,340017,","26-MAR-26","","","","",""
"60691382","禾引源永續股份有限公司","新北市新店區中央路155號18樓之1","10000000","10000000"," ","1140421","新北市新店區福民里中央路１５５號１８樓之１","011399,,,","26-MAR-26","","","","",""
"60696648","朔原能源有限公司","新北市新莊區榮華路1段133號12樓","500000"," "," ","1140516","新北市新莊區榮華路１段１３３號１２樓","433211,,,","26-MAR-26","","","","",""
"60697034","熊鋼動力股份有限公司","新北市八里區觀海大道268號(3樓)","500000000","21850000"," ","1140519","新北市八里區觀海大道２６８號（３樓）","281012,281099,289011,319014","26-MAR-26","","","","",""
"60697597","岳馳科技股份有限公司","新北市樹林區學林路162號3樓","50000000","4000000"," ","1140520","新北市樹林區柑園里學林路１６２號３樓","433900,,,","26-MAR-26","","","","",""
"60707005","旭奇能源股份有限公司","新北市中和區中山路2段332巷13號9樓","100000000","50000000"," ","1140320","新北市中和區中原里中山路２段３３２巷１３號９樓","464922,464211,,","26-MAR-26","","","","",""
"60707201","弘牧科技有限公司","新北市板橋區仁化街48號4樓","1000000"," "," ","1140321","新北市板橋區仁化街４８號４樓","464111,464112,,","26-MAR-26","","","","",""
"60707363","永續光電股份有限公司","新北市新莊區富貴路492號6樓","3000000","3000000"," ","1140321","新北市新莊區富貴路４９２號６樓","351000,,,","26-MAR-26","","","","",""
"60707461","鼎積資訊工程有限公司","新北市汐止區新台五路1段159號14樓之5","3000000"," "," ","1140321","新北市汐止區復興里新台五路一段１５９號十四樓之５","431015,433112,433212,","26-MAR-26","","","","",""
"60707722","碳井綠能有限公司","新北市土城區中山路77號","20000000"," "," ","1140324","新北市土城區中山路７７號","281099,,,","26-MAR-26","","","","",""
"60708594","艾爾圃有限公司","新北市新莊區化成路190巷4弄9號","350000"," "," ","1140326","新北市新莊區化成里化成路１９０巷４弄９號","670012,,,","26-MAR-26","","","","",""
"60716004","品擎機電工程有限公司","新北市蘆洲區中正路287巷5號4樓","5000000"," "," ","1140416","新北市蘆洲區中原里中正路２８７巷５號４樓","433199,433212,,","26-MAR-26","","","","",""
"60716829","響石科技股份有限公司","新北市新店區北新路1段89號13樓之3","20000000","1000000"," ","1140421","新北市新店區張南里北新路１段８９號１３樓之３","464922,464211,,","26-MAR-26","","","","",""
"60729697","友嘉工程顧問有限公司","新北市板橋區五權街9號(1樓)","100000"," "," ","1140526","新北市板橋區五權里五權街９號（１樓）","292700,340017,433211,760911","26-MAR-26","","","","",""
"60739983","三盛企業股份有限公司","新北市中和區景新街178之1號(2樓)","5000000","5000000"," ","1020913","新北市中和區景安里景新街１７８－１號２樓","483111,456199,457299,455999","26-MAR-26","","","","",""
"60740383","日正智能有限公司","新北市中和區中山路2段332巷13號9樓","3000000"," "," ","1140310","新北市中和區中原里中山路２段３３２巷１３號９樓","281099,464211,,","26-MAR-26","","","","",""
"60740519","泰陽電力股份有限公司","新北市三重區光復路1段61巷27號6樓之2","30000000","30000000"," ","1140311","新北市三重區五谷里光復路１段６１巷２７號６樓之２","433199,351000,,","26-MAR-26","","","","",""
"60740530","祖榮鋼鐵有限公司","新北市新莊區五工一路97巷2號5樓","1000000"," "," ","1140311","新北市新莊區福興里五工一路９７巷２號５樓","252100,,,","26-MAR-26","","","","",""
"60741117","海芯國際資創有限公司","新北市鶯歌區鶯桃路658巷16號(1樓)","18000000"," "," ","1140312","新北市鶯歌區鳳鳴里鶯桃路６５８巷１６號（１樓）","281099,292999,,","26-MAR-26","","","","",""
"60748646","海森源管理顧問有限公司","新北市三重區重新路5段609巷12號3樓之9","100000"," "," ","1140407","新北市三重區中興里重新路５段６０９巷１２號３樓之９","702099,,,","26-MAR-26","","","","",""
"60748694","海金豐管理顧問股份有限公司","新北市三重區重新路5段609巷12號3樓之9","50000000","10000000"," ","1140407","新北市三重區中興里重新路５段６０９巷１２號３樓之９","702099,,,","26-MAR-26","","","","",""
"60748815","海華新管理顧問有限公司","新北市三重區重新路5段609巷12號3樓之8","100000"," "," ","1140407","新北市三重區中興里重新路５段６０９巷１２號３樓之８","702099,,,","26-MAR-26","","","","",""
"60748836","海誠能源股份有限公司","新北市三重區重新路5段609巷12號3樓之9","5000000","100000"," ","1140407","新北市三重區中興里重新路５段６０９巷１２號３樓之９","433117,,,","26-MAR-26","","","","",""
"60749167","海洋星管理顧問有限公司","新北市三重區重新路5段609巷12號3樓之8","100000"," "," ","1140408","新北市三重區中興里重新路５段６０９巷１２號３樓之８","702099,,,","26-MAR-26","","","","",""
"60749835","捷泰水電有限公司","新北市樹林區仁愛街31號(1樓)","1000000"," "," ","1140410","新北市樹林區和平里仁愛街３１號","433199,,,","26-MAR-26","","","","",""
"60750071","澤洛科技有限公司","新北市三重區新北大道1段129號4樓","1000000"," "," ","1140411","新北市三重區光陽里０３０鄰新北大道１段１２９號４樓","433111,434013,812100,","26-MAR-26","","","","",""
"60755456","愛佳能有限公司","新北市板橋區文化路1段329號4樓","50000"," "," ","1140423","新北市板橋區忠誠里文化路１段３２９號４樓","340015,340017,433199,","26-MAR-26","","","","",""
"60755723","愛裕能有限公司","新北市永和區中山路1段24號2樓","50000"," "," ","1140424","新北市永和區信義里中山路１段２４號２樓","433199,,,","26-MAR-26","","","","",""
"60755940","昕力電力有限公司","新北市蘆洲區中山二路48號","1000000"," "," ","1140425","新北市蘆洲區中山二路４８號","464920,433199,351000,","26-MAR-26","","","","",""
"60779400","綠動未來綠能科技有限公司","新北市新店區北新路1段12號16樓","500000"," "," ","1140428","新北市新店區中興里北新路１段１２號１６樓","702099,,,","26-MAR-26","","","","",""
"60779485","義華綠氫有限公司","新北市新莊區新泰路305巷3號地下1樓","6000000"," "," ","1140428","新北市新莊區立泰里新泰路３０５巷３號地下１樓","433199,,,","26-MAR-26","","","","",""
"60780119","愛立能有限公司","新北市新店區民權路108號地下一層","50000"," "," ","1140430","新北市新店區復興里民權路１０８號地下一層","281099,283100,,","26-MAR-26","","","","",""
"60780238","愛盛能有限公司","新北市板橋區文化路2段285號21樓","50000"," "," ","1140430","新北市板橋區江翠里文化路２段２８５號２１樓","281099,283100,,","26-MAR-26","","","","",""
"60780693","榮泰顧問有限公司","新北市土城區水源街81巷16號2樓","100000"," "," ","1140502","新北市土城區水源街８１巷１６號２樓","702099,,,","26-MAR-26","","","","",""
"60780808","聚晟國際有限公司","新北市新店區安興路105號5樓之2","100000"," "," ","1140502","新北市新店區安和里安興路１０５號５樓之２","859399,,,","26-MAR-26","","","","",""
"60782067","翰呈營造有限公司","新北市板橋區中山路1段10號9樓","4000000"," "," ","1140509","新北市板橋區景星里中山路１段１０號９樓","434011,782000,,","26-MAR-26","","","","",""
"60782799","智維雲圖有限公司","新北市汐止區福德二路79號2樓","100000"," "," ","1140513","新北市汐止區中興里福德二路７９號二樓","631299,,,","26-MAR-26","","","","",""
"60791137","鎔合生物技術有限公司","新北市汐止區新台五路1段99號14樓之11","12000000"," "," ","1140425","新北市汐止區復興里新台五路一段９９號十四樓之１１","760912,721000,454399,454400","26-MAR-26","","","","",""
"63883992","道邦電子有限公司","新北市新莊區五權一路7號6樓之7","5681500"," "," ","1070115","新北市新莊區福興里五權一路７號６樓之７","281099,289011,289099,760999","26-MAR-26","","","","",""
"64349202","力山綠能科技有限公司","新北市三重區重新路2段21號8樓","10000000"," "," ","1050906","新北市三重區文化里重新路２段２１號８樓","351000,,,","26-MAR-26","","","","",""
"64912334","富鴻達國際事業股份有限公司","新北市新莊區中環路3段200號18樓","60600000","60600000"," ","1060613","新北市新莊區中環路三段２００號十八樓","340099,464999,524100,433900","26-MAR-26","","","","",""
"65185944","良欣科技有限公司","新北市中和區中山路2段348巷2號10樓","20000000"," "," ","1050818","新北市中和區中原里中山路二段３４８巷２號１０樓","269999,,,","26-MAR-26","","","","",""
"65237605","上能投資股份有限公司","新北市中和區中正路716號13樓之9","1000000","1000000"," ","1050824","新北市中和區平河里中正路７１６號１３樓之９","669199,,,","26-MAR-26","","","","",""
"65405601","浩源興業有限公司","新北市石碇區大溪墘8之1號","1000000"," "," ","1050906","新北市石碇區永定里大溪墘８─１號","434011,433111,,","26-MAR-26","","","","",""
"65410111","富新電機有限公司","新北市樹林區佳園路2段61之6號(2樓)","15000000"," "," ","1050906","新北市樹林區北園里佳園路２段６１之６號","281099,243311,,","26-MAR-26","","","","",""
"65484133","金石有限公司","新北市中和區捷運路8之21號6樓","3720000"," "," ","1050908","新北市中和區景福里捷運路８－２１號６樓","454399,,,","26-MAR-26","","","","",""
"65490803","永日昇綠能有限公司","新北市五股區中興路4段40號6樓","10000000"," "," ","1050909","新北市五股區五股里中興路４段４０號６樓","351000,340015,,","26-MAR-26","","","","",""
"65532070","俊曜工程有限公司","新北市五股區中興路3段45巷5-8號","66000000"," "," ","1050912","新北市五股區更寮里中興路３段４５巷５－８號","382112,381111,,","26-MAR-26","","","","",""
"65536809","遠東能源科技有限公司","新北市泰山區忠孝街43號2樓","5000000"," "," ","1050919","新北市泰山區山腳里忠孝街４３號２樓","760999,,,","26-MAR-26","","","","",""
"65595089","緯岑國際有限公司","新北市深坑區松柏街43巷34弄6號","1000000"," "," ","1050901","新北市深坑區土庫里松柏街４３巷３４弄６號","483299,,,","26-MAR-26","","","","",""
"65601765","悅序有限公司","新北市永和區豫溪街36號","4000000"," "," ","1050920","新北市永和區豫溪里豫溪街３６號","340099,,,","26-MAR-26","","","","",""
"65731900","翊鑫能源有限公司","新北市新莊區後港一路113號5樓","10000000"," "," ","1050930","新北市新莊區建福里後港一路１１３號５樓","464299,351000,760999,","26-MAR-26","","","","",""
"65936208","鈊邦企業有限公司","新北市板橋區長江路1段111之4號","2000000"," "," ","1051012","新北市板橋區宏翠里長江路１段１１１之４號","433211,433115,,","26-MAR-26","","","","",""
"66288763","鑫宏建設有限公司","新北市三重區自強路4段77之1號","20000000"," "," ","1051111","新北市三重區溪美里自強路４段７７之１號","434012,,,","26-MAR-26","","","","鑫宏建設,SHINHUNG CONSTRUCTION,","2024-11-27"
"66361010","峖誠有限公司","新北市永和區永亨路146巷1號(1樓)","6000000"," "," ","1051208","新北市永和區秀朗里永亨路１４６巷１號（１樓）","281099,,,","26-MAR-26","","","","",""
"66396670","照鵬能源有限公司","新北市汐止區鄉長路2段6巷31號6樓","2000000"," "," ","1051221","新北市汐止區鄉長里鄉長路二段６巷３１號６樓","292999,433199,,","26-MAR-26","","","","",""
"66406430","松岑能源股份有限公司","新北市汐止區新台五路1段99號8樓之2","20000000","20000000"," ","1051228","新北市汐止區復興里新台五路一段９９號八樓之２","351000,353012,433900,","26-MAR-26","","","","",""
"66413523","景泰電氣工程有限公司","新北市新莊區新北大道7段568號12樓","1200000"," "," ","1051230","新北市新莊區新北大道７段５６８號１２樓","433900,,,","26-MAR-26","","","","",""
"66420783","承太新能源股份有限公司","新北市汐止區大同路1段237號17樓之3","15000000","15000000"," ","1060105","新北市汐止區樟樹里大同路一段２３７號１７樓之３","353011,340099,,","26-MAR-26","","","","",""
"66424129","錦德熱傳科技有限公司","新北市土城區中華路1段55號4樓","2000000"," "," ","1060109","新北市土城區裕生里中華路１段５５號４樓","433211,353011,,","26-MAR-26","","","","HE SI M T P RH,","2024-11-27"
"66428146","龍板建設股份有限公司","新北市中和區捷運路8之15號11樓","88000000","88000000"," ","1060111","新北市中和區景福里捷運路８－１５號１１樓","434011,,,","26-MAR-26","","","","",""
"66438812","盛齊綠能股份有限公司","新北市新店區中興路2段190號8樓之1","500000000","184575000"," ","1060118","新北市新店區寶福里中興路２段１９０號８樓之１","281099,711299,,","26-MAR-26","","","","盛齊綠能,BILLION WATTS,W BILLION WATTS,","2024-11-27"
"66440182","恆暘股份有限公司","新北市新店區寶橋路262號(3樓)","20000000","20000000"," ","1060116","新北市新店區寶福里寶橋路２６２號（３樓）","292800,,,","26-MAR-26","","","","EVERBLISS GREEN,EVERBLISS GREEN EG,","2024-11-27"
"66452476","欣宇山野顧問有限公司","新北市板橋區富山街53巷33號","500000"," "," ","1060120","新北市板橋區雙玉里富山街５３巷３３號","474199,434011,433111,","26-MAR-26","","","","",""
"66456682","傑鼎技術股份有限公司","新北市新店區檳榔路19巷38號4樓","10000000","10000000"," ","1060124","新北市新店區中興里檳榔路１９巷３８號４樓","711299,,,","26-MAR-26","","","","",""
"66465388","成遠科技有限公司","新北市三重區永福街161巷5號","11000000"," "," ","1060207","新北市三重區永順里永福街１６１巷５號","340015,,,","26-MAR-26","","","","",""
"66469899","亞煌工程股份有限公司","新北市三重區大同北路253巷18號","1000000","1000000"," ","1060210","新北市三重區民生里大同北路２５３巷１８號１樓","092099,331400,331299,","26-MAR-26","","","","",""
"66487524","東元茂迪股份有限公司","新北市深坑區北深路3段248號6樓","100000000","24000000"," ","1060221","新北市深坑區萬福里北深路３段２４８號６樓","464211,,,","26-MAR-26","","","","",""
